week,year,brand,coitem,product,co_volume,do_volume,co_value,do_value,kr,casefill,loss_pcs,cont_loss_pcs_by_brand,loss_value,cont_loss_value_by_brand,problem,action,estimation_recovery
21,2023,WARDAH,TC-LPGBB01-W11GR,WARDAH LIGHTENING BB CAKE POWDER 01 LIGHT 11 GR (PC(S)),12,0,714000,0,,0,12,0.0001,714000,0.0002,,,
21,2023,WARDAH,BO-W1B-W4GR,WARDAH BLUSH ON B 4 GR,12,0,558000,0,,0,12,0.0001,558000,0.0001,,,
21,2023,WARDAH,BO-COCBSCD-W,WARDAH COLORFIT CREAM BLUSH 01 SAND CORAL DEENAY 3 G,12,0,600000,0,,0,12,0.0001,600000,0.0001,,,
21,2023,WARDAH,TC-RLPGBB01-W11GR,WARDAH REFILL LIGHTENING BB CAKE POWDER 01 LIGHT 11 GR,12,0,492000,0,,0,12,0.0001,492000,0.0001,,,
21,2023,WARDAH,TC-RLPGBB03-W11GR,WARDAH REFILL LIGHTENING BB CAKE POWDER 03 NATURAL 11 GR,12,0,492000,0,,0,12,0.0001,492000,0.0001,,,
21,2023,WARDAH,TC-RR3LEC02-W,WARDAH REFILL LIGHTENING POWDER FOUNDATION EXTRA COVER 02 GOLDEN BEIGE 10 G,1731,1719,70715060,70227060,2152.355227,0.9931,12,0.0001,488000,0.0001,,,
21,2023,WARDAH,SRM-RWSIBS-W,WARDAH CRYSTAL SECRET DARK SPOT & BRIGHTENING SERUM 20 ML,16839,16828,1500726288,1499717788,22257.3666,0.9993,11,0.0001,1008500,0.0002,,,
21,2023,WARDAH,FW-RPBCFLO50-W,WARDAH PERFECT BRIGHT CREAMY FOAM BRIGHT + OIL CONTROL 50 ML,21970,21959,437204814,436977780,38592.76553,0.9995,11,0.0001,227034,0.0001,,,
21,2023,WARDAH,FM-NDOES-W,WARDAH NATURE DAILY MILKY OAT EXFOLIATING SCRUB CAPSULE MASK 10 ML,265,254,5676000,5441000,332.7142733,0.9585,11,0.0001,235000,0.0001,,,
21,2023,WARDAH,BP-SPNE-W35ML,WARDAH SCENTSATION PASSION EAU DE TOILETTE 35 ML (PC(S)),569,558,31897500,31272000,949.1454464,0.9807,11,0.0001,625500,0.0002,,,
21,2023,WARDAH,L-EMC16-W4GR,WARDAH EXCLUSIVE MATTE LIP CREAM 16 HEARTBEET 4 GR (PC(S)),49,38,3225500,2527000,,0.7755,11,0.0001,698500,0.0002,,,
21,2023,WARDAH,F-LLF01-W,WARDAH LIGHTENING LIQUID FOUNDATION 01. LIGHT BEIGE 25 ML (BLISTER),4590,4580,240687551,240167551,6421.007946,0.9978,10,0.0001,520000,0.0001,,,
21,2023,WARDAH,BBC-LN-W15ML,WARDAH LIGHTENING BB CREAM NATURAL 15 ML (PC(S)),16244,16234,539123835,538787835,18153.33965,0.9994,10,0.0001,336000,0.0001,Bahan Baku Tudor Eboni shortage,"Bahan baku tudor eboni sudah ada kedatangan qty masih belum banyak, alokasi ke BB Cream dan DD Cream, liq found untuk produksi di W19/W20",W22
21,2023,WARDAH,FM-NDASR-W,WARDAH NATURE DAILY ALPINE APPLE NUTRITIVE GEL CAPSULE MASK 10 ML,151,141,3248000,3028000,145.4668701,0.9338,10,0.0001,220000,0.0001,,,
21,2023,WARDAH,LW-W3P-W150ML,WARDAH SOFT BODY SCRUB WITH PASSION FRUIT 150 ML (PC(S)),156,146,7222000,6755000,246.2106455,0.9359,10,0.0001,467000,0.0001,,,
21,2023,WARDAH,TC-R2RE01-W,WARDAH REFILL EXCLUSIVE TWO WAY CAKE 01 SHEER PINK 12 G,3798,3788,221505540,220916540,6819.436701,0.9974,10,0.0001,589000,0.0001,,,
21,2023,WARDAH,TC-W3RELLI4-W12G,WARDAH REFILL EVD LUM TWO WAY CAKE 04 LIGHT IVORY 12 G (PC(S)),1989,1980,69026280,68715780,1897.716597,0.9955,9,0.0001,310500,0.0001,,,
21,2023,WARDAH,L-LL18-W2.3G,WARDAH LIPSTICK LONGLASTING 18 SUNSET ORANGE 2.3 G,9,0,442500,0,,0,9,0.0001,442500,0.0001,,,
21,2023,WARDAH,F-LLF04-W,WARDAH LIGHTENING LIQUID FOUNDATION 04. NATURAL 25 ML (BLISTER),3256,3247,171036851,170568851,3732.38728,0.9972,9,0.0001,468000,0.0001,,,
21,2023,WARDAH,TWC-CLFTH-W,WARDAH COLORFIT VELVET POWDER FOUNDATION 52N ALMOND 11 G,223,214,16636075,15966575,153.7777495,0.9596,9,0.0001,669500,0.0002,,,
21,2023,WARDAH,FW-CD-W100ML,WARDAH C-DEFENSE ENERGIZING CREAMY WASH 100 ML (PC(S)),20689,20680,707968044,707662044,45167.01459,0.9996,9,0.0001,306000,0.0001,,,
21,2023,WARDAH,M-WSDGN2-W,WARDAH CRYSTAL SECRET REFRESHING DAY GEL 30 G,558,549,56625000,55715000,661.1916475,0.9839,9,0.0001,910000,0.0002,,,
21,2023,WARDAH,CUS-RREFC01-W,WARDAH REFILL EXCLUSIVE FLAWLESS COVER CUSHION 01 LIGHT BEIGE 15 G,357,348,35596500,34701000,523.6945488,0.9748,9,0.0001,895500,0.0002,,,
21,2023,WARDAH,"L-LLW0C1-W2,5GR",WARDAH LONGLASTING LIPSTICK 01 FABULOUS PEACH 2.3 G (PC(S)),9,0,436500,0,,0,9,0.0001,436500,0.0001,,,
21,2023,WARDAH,A-FP-W20G,WARDAH ACNEDERM FACE POWDER 20 G (PC(S)),1772,1763,84159510,83729010,2439.694879,0.9949,9,0.0001,430500,0.0001,,,
21,2023,WARDAH,SRM-RWSPTEN4-W,WARDAH CRYSTAL SECRET PURE TREATMENT ESSENCE 30 ML,1347,1338,68853501,68399001,2194.335089,0.9933,9,0.0001,454500,0.0001,,,
21,2023,WARDAH,LB-EVFSSSE-W,WARDAH EVERYDAY FRUITY SHEER LIP BALM PICNIC EDITION STRAWBERRY 4 G,32,23,884000,644000,,0.7188,9,0.0001,240000,0.0001,,,
21,2023,WARDAH,EB-EK-W3G,WARDAH EYEXPERT EYEBROW KIT 3 G (PC(S)),1352,1343,86257150,85690150,1714.468944,0.9933,9,0.0001,567000,0.0001,,,
21,2023,WARDAH,L-LL15-W2.3G,WARDAH LIPSTICK LONGLASTING 15 ROUGE RED 2.3 G (PC(S)),9,0,442500,0,,0,9,0.0001,442500,0.0001,,,
21,2023,WARDAH,L-LL03-W2.3G,WARDAH LIPSTICK LONGLASTING 03 SIMPLY BROWN 2.3 G (PC(S)),287,278,14385500,13944500,620.9821269,0.9686,9,0.0001,441000,0.0001,,,
21,2023,WARDAH,L-RCLCLS2-W,WARDAH COLORFIT FRESH LIP INK SERUM 02 SMART COOKIE 4 G,414,406,25632340,25144340,617.4686467,0.9807,8,0.0001,488000,0.0001,,,
21,2023,WARDAH,FW-PBCFLS-W60ML,WARDAH PERFECT BRIGHT CREAMY FOAM BRIGHTENING + SMOOTHING 60 ML (PC(S)),8,0,159600,0,,0,8,0.0001,159600,0,,,
21,2023,WARDAH,TC-RRE02-W,WARDAH REFILL EXCLUSIVE TWO WAY CAKE 02 LIGHT BEIGE 12 G,14,6,812000,348000,,0.4286,8,0.0001,464000,0.0001,,,
21,2023,WARDAH,EL-W1B-WTA,WARDAH EYE LINER BLACK,5838,5830,251029810,250677810,6049.255627,0.9986,8,0.0001,352000,0.0001,,,
21,2023,WARDAH,BBC-LN-W30ML,WARDAH LIGHTENING BB CREAM NATURAL 30 ML (PC(S)),1871,1863,118810808,118308408,2069.946504,0.9957,8,0.0001,502400,0.0001,,,
21,2023,WARDAH,LW-W3S-W150ML,WARDAH SOFT BODY SCRUB WITH STRAWBERRY 150 ML (PC(S)),177,169,8161500,7797500,226.9272369,0.9548,8,0.0001,364000,0.0001,,,
21,2023,WARDAH,BP-SBSE-W35ML,WARDAH SCENTSATION BLISS EAU DE TOILETTE 35 ML (PC(S)),856,848,48139515,47695515,1462.520503,0.9907,8,0.0001,444000,0.0001,,,
21,2023,WARDAH,TC-R2RE05-W,WARDAH REFILL EXCLUSIVE TWO WAY CAKE 05 COFFEE BEIGE 12 G,508,500,29897560,29424560,795.0519394,0.9843,8,0.0001,473000,0.0001,,,
21,2023,WARDAH,TWC-CLFTRC-W,WARDAH COLORFIT VELVET POWDER FOUNDATION REFILL 23W WARM IVORY 11 G,2339,2332,114203499,113863999,2766.444082,0.997,7,0.0001,339500,0.0001,,,
21,2023,WARDAH,FW-MCF-W60ML,WARDAH NATURE DAILY MINERAL+ CLARIFYING FACIAL FOAM 60 ML,2016,2009,41062510,40920510,3124.035102,0.9965,7,0.0001,142000,0,,,
21,2023,WARDAH,TC-R3LEC04-W,WARDAH LIGHTENING POWDER FOUNDATION EXTRA COVER 04 NATURAL 10 G,766,759,45805005,45347445,1112.306804,0.9909,7,0.0001,457560,0.0001,,,
21,2023,WARDAH,FM-NDTOC-W,WARDAH NATURE DAILY TEA TREE OIL CONTROL CLAY CAPSULE MASK 10 ML,232,225,4966000,4819000,381.6239858,0.9698,7,0.0001,147000,0,,,
21,2023,WARDAH,F-RRELF01-W,WARDAH EXCLUSIVE LIQUID FOUNDATION 01 LIGHT BEIGE 20 ML,1826,1819,159324620,158719120,2646.66529,0.9962,7,0.0001,605500,0.0001,,,
21,2023,WARDAH,BP-SPRE-W35ML,WARDAH SCENTSATION PURITY EAU DE TOILETTE 35 ML (PC(S)),1373,1366,77224740,76804935,1887.146144,0.9949,7,0.0001,419805,0.0001,,,
21,2023,WARDAH,BP-SPNBM-W100ML,WARDAH SCENTSATION PASSION BODY MIST 100 ML (PC(S)),1143,1136,44541775,44260275,1947.440107,0.9939,7,0.0001,281500,0.0001,,,
21,2023,WARDAH,L-LL10-W2.3G,WARDAH LIPSTICK LONGLASTING 10 STYLISH MOCCA 2.3 G (PC(S)),454,447,22686000,22335500,674.4165167,0.9846,7,0.0001,350500,0.0001,,,
21,2023,WARDAH,BP-SBSBM-W100ML,WARDAH SCENTSATION BLISS BODY MIST 100 ML (PC(S)),1810,1803,70553470,70271970,3329.176126,0.9961,7,0.0001,281500,0.0001,,,
21,2023,WARDAH,M-RWSDCN1-W,WARDAH CRYSTAL SECRET BRIGHTENING DAY CREAM 15 ML,22370,22364,1137205121,1136905121,31590.57826,0.9997,6,0.0001,300000,0.0001,,,
21,2023,WARDAH,P-RPB04-W,WARDAH BUNDLING PACKAGE 3 COLORFIT,26,20,3698500,2858500,,0.7692,6,0.0001,840000,0.0002,,,
21,2023,WARDAH,TC-RE05-W,WARDAH EXCLUSIVE TWO WAY CAKE 05 COFFEE BEIGE 12 G,6,0,562800,0,,0,6,0.0001,562800,0.0001,,,
21,2023,WARDAH,TC-W3RELI3-W12G,WARDAH REFILL EVD LUM TWO WAY CAKE 03 IVORY 12 G (PC(S)),2841,2835,98780220,98573220,3542.828371,0.9979,6,0.0001,207000,0.0001,,,
21,2023,WARDAH,REM-PBTUMW-W,WARDAH PERFECT BRIGHT TONE UP MICELLAR WATER 100 ML,49,43,1534500,1354500,,0.8776,6,0.0001,180000,0,,,
21,2023,WARDAH,M-RPBNS-W20ML,WARDAH PERFECT BRIGHT MOISTURIZER NORMAL SKIN 20 ML (PC(S)),6,0,168600,0,,0,6,0.0001,168600,0,,,
21,2023,WARDAH,BBC-EN-W15ML,WARDAH EVERYDAY BB CREAM NATURAL 15 ML (PC(S)),12670,12664,365746756,365571556,16099.55116,0.9995,6,0.0001,175200,0,Item baru masuk NDC W21,Percepatan distribusi ke DC,
21,2023,WARDAH,FW-RPBCFLS100-W,WARDAH PERFECT BRIGHT CREAMY FOAM BRIGHT + SMOOTH GLOW 100 ML,25569,25563,757691892,757508892,42466.23187,0.9998,6,0.0001,183000,0,,,
21,2023,WARDAH,MA-NDSGT-W,WARDAH NATURE DAILY SHEET MASK GREEN TEA 20 ML,6,0,102000,0,,0,6,0.0001,102000,0,,,
21,2023,WARDAH,SRM-AGIS-W17ML,WARDAH RENEW YOU ANTI AGING INTENSIVE SERUM 17 ML (PC(S)),6,0,558000,0,,0,6,0.0001,558000,0.0001,,,
21,2023,WARDAH,FM-NDAAB-W,WARDAH NATURE DAILY AMAZONIAN ACAI BERRY ANTIOXIDANT CAPSULE MASK 10 ML,163,157,3525000,3396000,148.7622361,0.9632,6,0.0001,129000,0,,,
21,2023,WARDAH,SRM-ESE-W100ML,WARDAH NATURE DAILY SEAWEED PRIMARY SKIN HYDRATING BOOSTER 100 ML,6,0,213000,0,,0,6,0.0001,213000,0.0001,,,
21,2023,WARDAH,HBL-HAVG-W100ML,WARDAH HYDRATING ALOE VERA GEL 100 ML (PC(S)),6,0,234000,0,,0,6,0.0001,234000,0.0001,,,
21,2023,WARDAH,FW-RHMF-W,WARDAH HYDRA ROSE GEL TO FOAM CLEANSER 100 ML,9087,9081,347641615,347416615,10923.59687,0.9993,6,0.0001,225000,0.0001,,,
21,2023,WARDAH,L-CUM05-W,WARDAH COLORFIT ULTRALIGHT MATTE LIPSTICK 05 BLOSSOM PINK 3.6 G,2203,2197,101594500,101315500,2846.951289,0.9973,6,0.0001,279000,0.0001,,,
21,2023,WARDAH,REM-SBMW-W100ML,WARDAH NATURE DAILY SEAWEED CLEANSING MICELLAR WATER 100 ML,11154,11148,328099522,327921022,13981.09219,0.9995,6,0.0001,178500,0,,,
21,2023,WARDAH,EB-EXPMBD01-W,WARDAH EYEXPERT MATIC BROW DEFINER 01 LIGHT BROWN 0.25 G,2223,2217,122565610,122238610,2676.576696,0.9973,6,0.0001,327000,0.0001,,,
21,2023,WARDAH,L-LL19-W2.3G,WARDAH LIPSTICK LONGLASTING 19 SUNRISE NUDE 2.3 G,6,0,300000,0,,0,6,0.0001,300000,0.0001,,,
21,2023,WARDAH,TWC-CLFTF-W,WARDAH COLORFIT VELVET POWDER FOUNDATION 43W GOLDEN SAND 11 G,670,664,49993000,49549000,732.8929293,0.991,6,0.0001,444000,0.0001,,,
21,2023,WARDAH,DDC-CDN-W20ML,WARDAH C-DEFENSE DD CREAM NATURAL 20 ML (PC(S)),7161,7155,227093041,226895041,9000.940244,0.9992,6,0.0001,198000,0,Bahan Baku Tudor Eboni shortage,"Bahan baku tudor eboni sudah ada kedatangan qty masih belum banyak, alokasi ke BB Cream dan DD Cream, liq found untuk produksi di W19/W20",W22
21,2023,WARDAH,S-NSSEC-W,WARDAH NUTRI SHINE SHAMPOO 170 ML,3233,3227,81643620,81496620,4492.925801,0.9981,6,0.0001,147000,0,,,
21,2023,WARDAH,L-REMO29-W,WARDAH EXCLUSIVE MOIST LIPSTICK 29 LAVENDER 3.5 G,386,380,16917785,16654785,609.2469546,0.9845,6,0.0001,263000,0.0001,,,
21,2023,WARDAH,M-RHDGN1-W,WARDAH HYDRA ROSE DEWY AQUA DAY GEL 40 G,723,718,77100930,76575930,724.4934169,0.9931,5,0.0001,525000,0.0001,,,
21,2023,WARDAH,MY-TCR3LLF04-W,MALAYSIA WARDAH LIGHTENING POWDER FOUNDATION LIGHT FEEL 04 NATURAL 12 G,5,0,230554.5,0,1934.635882,0,5,0.0001,230554.5,0.0001,,,
21,2023,WARDAH,MA-NDSRO-W,WARDAH NATURE DAILY SHEET MASK ROSE 20 ML,5,0,85000,0,,0,5,0.0001,85000,0,,,
21,2023,WARDAH,L-IM09-W2.3G,WARDAH INTENSE MATTE LIPSTICK 09 VIBRANT-RED 2.3 G (PC(S)),5,0,237500,0,,0,5,0.0001,237500,0.0001,,,
21,2023,WARDAH,M-LDCN1-W,WARDAH LIGHTENING DAY CREAM ADVANCED NIACINAMIDE 20 ML,36970,36965,1146672924,1146520424,62183.43473,0.9999,5,0.0001,152500,0,,,
21,2023,WARDAH,FW-CDEWN1-W,WARDAH C-DEFENSE ENERGIZING WHIP FOAM 50 ML,2156,2151,53240084,53117584,2866.507378,0.9977,5,0.0001,122500,0,,,
21,2023,WARDAH,F-CLCMD-W,WARDAH COLORFIT MATTE FOUNDATION 32N NEUTRAL BEIGE 25 ML,1567,1562,114555801,114179301,1472.403651,0.9968,5,0.0001,376500,0.0001,,,
21,2023,WARDAH,L-CUM02-W,WARDAH COLORFIT ULTRALIGHT MATTE LIPSTICK 02 SUMMER PEACH 3.6 G,964,959,44335045,44085870,1315.020922,0.9948,5,0.0001,249175,0.0001,,,
21,2023,WARDAH,MY-MRHOVN1-W,MALAYSIA WARDAH HYDRA ROSE MOISTURE RICH NIGHT GEL 40 G,30,26,2590500,2245100,713.3262991,0.8667,4,0,345400,0.0001,,,
21,2023,WARDAH,L-REMA09-W,WARDAH EXCLUSIVE MATTE LIPSTICK 09 TRUE RED 3.5 G,717,713,31444440,31270440,1245.273272,0.9944,4,0,174000,0,,,
21,2023,WARDAH,"L-LLW0C12-W2,5GR",WARDAH LONGLASTING LIPSTICK 12 LUSTROUS RED 2.3 G (PC(S)),4,0,191500,0,,0,4,0,191500,0,,,
21,2023,WARDAH,F-LLF02-W,WARDAH LIGHTENING LIQUID FOUNDATION 02. BEIGE 25 ML (BLISTER),8316,8312,441585781,441377781,10614.14329,0.9995,4,0,208000,0.0001,,,
21,2023,WARDAH,M-LNCN2-W,WARDAH LIGHTENING NIGHT CREAM ADVANCED NIACINAMIDE 30 G,17111,17107,820853472,820658472,22144.76544,0.9998,4,0,195000,0,,,
21,2023,WARDAH,TC-RR2LLF04-W,WARDAH REFILL LIGHTENING TWO WAY CAKE LIGHT FEEL 04 NATURAL 12 G,4,0,144000,0,,0,4,0,144000,0,,,
21,2023,WARDAH,CUS-REFC02-W,WARDAH REFILL EXCLUSIVE FLAWLESS COVER CUSHION 02 HONEY BEIGE 15 G,24,21,2418000,2119500,,0.875,3,0,298500,0.0001,,,
21,2023,WARDAH,TWC-CLFTRD-W,WARDAH COLORFIT VELVET POWDER FOUNDATION REFILL 32N NEUTRAL BEIGE 11 G,2516,2513,123095334,122943834,3004.855978,0.9988,3,0,151500,0,,,
21,2023,WARDAH,L-CLCLS4-W,WARDAH COLORFIT FRESH MATTE LIP INK 04 SPEEDSTER 4 G,8,5,497000,314000,,0.625,3,0,183000,0,,,
21,2023,WARDAH,"F-WODF-W4,5GR","WARDAH DOUBLE FUNCTION KIT 4,5 GR",32,29,1654500,1494000,,0.9063,3,0,160500,0,,,
21,2023,WARDAH,SRM-RRYUMS-W,WARDAH RENEW YOU INTENSIVE SERUM 30 ML (PC(S)),1038,1035,179997500,179483000,2007.666818,0.9971,3,0,514500,0.0001,,,
21,2023,WARDAH,REM-EEM-W100ML,WARDAH EYEXPERT EYE & LIP MAKEUP REMOVER 100 ML,2435,2432,102329210,102198710,3031.801963,0.9988,3,0,130500,0,,,
21,2023,WARDAH,FS-SB-W100ML,WARDAH NATURE DAILY SEAWEED BALANCING FACIAL SCRUB 100 ML,3,0,84000,0,,0,3,0,84000,0,,,
21,2023,WARDAH,P-LHRM-W,WARDAH LIGHTENING HAMPERS RAMADAN UNTUK MENCERAHKAN,3,0,343500,0,,0,3,0,343500,0.0001,,,
21,2023,WARDAH,L-CVM08-W,WARDAH COLORFIT VELVET MATTE LIP MOUSSE 08 BROWN CREATOR 4 G,3454,3451,261815961,261590961,5361.299628,0.9991,3,0,225000,0.0001,,,
21,2023,WARDAH,EB-EXPMBD03-W,WARDAH EYEXPERT MATIC BROW DEFINER 03 DARK GREY 0.25 G,1474,1471,81111300,80947800,1940.739346,0.998,3,0,163500,0,,,
21,2023,WARDAH,FM-RYUL-W30G,WARDAH RENEW YOU HYDRAFIRM SLEEPING MASK 30 G,3,0,334500,0,,0,3,0,334500,0.0001,,,
21,2023,WARDAH,S-USGWP-W170ML,WARDAH HAIRFALL TREATMENT SHAMPOO 170 ML + GWP SISIR,3,0,73500,0,,0,3,0,73500,0,,,
21,2023,WARDAH,CM-LCC-W,WARDAH LIGHTENING CLEANSING MILK 100 ML,9381,9378,191361842,191301842,14050.86619,0.9997,3,0,60000,0,,,
21,2023,WARDAH,FM-PBPO-W60ML,WARDAH PERFECT BRIGHT PEEL OFF MASK 60 ML,3,0,104700,0,,0,3,0,104700,0,,,
21,2023,WARDAH,S-A1GWP-W170ML,WARDAH ANTI DANDRUFF SHAMPOO 170 ML + GWP SISIR,3,0,73500,0,,0,3,0,73500,0,,,
21,2023,WARDAH,S-HMGWP-W170ML,WARDAH DAILY FRESH SHAMPOO 170 ML + GWP SISIR,3,0,73500,0,,0,3,0,73500,0,,,
21,2023,WARDAH,L-EMC07-W4GR,WARDAH EXCLUSIVE MATTE LIP CREAM 07 HELLO RUBY 4 GR (PC(S)),3,0,199500,0,,0,3,0,199500,0,,,
21,2023,WARDAH,L-EMC11-W4GR,WARDAH EXCLUSIVE MATTE LIP CREAM 11 OH SO NUDE 4 GR (PC(S)),3,0,199500,0,,0,3,0,199500,0,,,
21,2023,WARDAH,MZ-W1M1-W50ML,WARDAH PURE OLIVE OIL 50 ML,846,843,23311500,23226000,1312.012851,0.9965,3,0,85500,0,,,
21,2023,WARDAH,CUS-REFC04-W,WARDAH REFILL EXCLUSIVE FLAWLESS COVER CUSHION 04 NATURAL 15 G,15,12,1492500,1194000,,0.8,3,0,298500,0.0001,,,
21,2023,WARDAH,F-W3ELLN-W40ML,WARDAH EVD LUM LIQUID FOUNDATION 04 NATURAL 40 ML (PC(S)),3,0,130500,0,,0,3,0,130500,0,,,
21,2023,WARDAH,F-W3ELLB51-W40ML,WARDAH EVD LUM LIQUID FOUNDATION 02 LIGHT BEIGE 40 ML (PC(S)),3,0,130500,0,,0,3,0,130500,0,,,
21,2023,WARDAH,FW-AH-W100ML,WARDAH NATURE DAILY ALOE HYDRAMILD FACIAL WASH 100 ML,9153,9150,265453312,265367812,11076.59722,0.9997,3,0,85500,0,,,
21,2023,WARDAH,M-PBNC20-W,WARDAH PERFECT BRIGHT BRIGHT + NIGHT GLOW NIGHT MOISTURIZER 20 ML,4794,4791,140377257,140285757,10530.0762,0.9994,3,0,91500,0,,,
21,2023,WARDAH,TC-R2LLF01-W,WARDAH LIGHTENING TWO WAY CAKE LIGHT FEEL 01 LIGHT BEIGE 12 G,3,0,159000,0,,0,3,0,159000,0,,,
21,2023,WARDAH,TC-R3LEC03-W,WARDAH LIGHTENING POWDER FOUNDATION EXTRA COVER 03 SHEER PINK 10 G,274,271,16269000,16093500,420.3367068,0.9891,3,0,175500,0,,,
21,2023,WARDAH,L-IM02-W2.3G,WARDAH INTENSE MATTE LIPSTICK 02 BLUSHING NUDE 2.3 G (PC(S)),3,0,150000,0,,0,3,0,150000,0,,,
21,2023,WARDAH,L-IM05-W2.3G,WARDAH INTENSE MATTE LIPSTICK 05 EASY BROWNIE 2.3 G (PC(S)),3,0,150000,0,,0,3,0,150000,0,,,
21,2023,WARDAH,L-IM06-W2.3G,WARDAH INTENSE MATTE LIPSTICK 06 BLOOMING PINK 2.3 G (PC(S)),3,0,150000,0,,0,3,0,150000,0,,,
21,2023,WARDAH,TC-RE02-W,WARDAH EXCLUSIVE TWO WAY CAKE 02 LIGHT BEIGE 12 G,12,9,1153800,872400,,0.75,3,0,281400,0.0001,,,
21,2023,WARDAH,L-LL04-W2.3G,WARDAH LIPSTICK LONGLASTING 04 ANTIQUE PINK 2.3 G (PC(S)),5,2,250000,100000,,0.4,3,0,150000,0,,,
21,2023,WARDAH,L-REMO35-W,WARDAH EXCLUSIVE MOIST LIPSTICK 35 GREAT BERRY 3.5 G,550,547,24195815,24065315,589.7659831,0.9945,3,0,130500,0,,,
21,2023,WARDAH,"L-LLW0C14-W2,5GR",WARDAH LONGLASTING LIPSTICK 14 VIOLET PINK 2.3 G (PC(S)),3,0,145500,0,,0,3,0,145500,0,,,
21,2023,WARDAH,TC-RRE03-W,WARDAH REFILL EXCLUSIVE TWO WAY CAKE 03 SANDY BEIGE 12 G,7,4,409000,235000,,0.5714,3,0,174000,0,,,
21,2023,WARDAH,HBW-NDAHHWN2-W,WARDAH NATURE DAILY ALOE HYDRAMILD HAND WASH 250 ML,62,59,1759500,1678500,,0.9516,3,0,81000,0,,,
21,2023,WARDAH,"L-LLW0C4-W2,5GR",WARDAH LONGLASTING LIPSTICK 04 ANTIQUE PINK 2.3 G (PC(S)),3,0,145500,0,,0,3,0,145500,0,,,
21,2023,WARDAH,"L-LLW0C6-W2,5GR",WARDAH LONGLASTING LIPSTICK 06 DELICATE PINK 2.3 G (PC(S)),3,0,145500,0,,0,3,0,145500,0,,,
21,2023,WARDAH,L-CVM011-W,WARDAH COLORFIT VELVET MATTE LIP MOUSSE 11 CHERISH MARMALADE 4 G,2482,2479,188129560,187904560,3392.6972,0.9988,3,0,225000,0.0001,,,
21,2023,WARDAH,FS-SB-W60ML,WARDAH NATURE DAILY SEAWEED BALANCING FACIAL SCRUB 60 ML,1453,1451,24552604,24519604,2282.808502,0.9986,2,0,33000,0,,,
21,2023,WARDAH,P-CSLAW-W,WARDAH BUNDLING COLORFIT SERIES LOOK A - WATSON,2,0,274000,0,,0,2,0,274000,0.0001,,,
21,2023,WARDAH,F-RRELF03-W,WARDAH EXCLUSIVE LIQUID FOUNDATION 03 SANDY BEIGE 20 ML,1796,1794,157209215,157027215,3004.677703,0.9989,2,0,182000,0,,,
21,2023,WARDAH,L-CUM01-W,WARDAH COLORFIT ULTRALIGHT MATTE LIPSTICK 01 PARFAIT PINK 3.6 G,777,775,35878505,35787505,1858.111228,0.9974,2,0,91000,0,,,
21,2023,WARDAH,L-EMC15-W4GR,WARDAH EXCLUSIVE MATTE LIP CREAM 15 PINKY PLUMISE 4 GR (PC(S)),5,3,317500,190500,,0.6,2,0,127000,0,,,
21,2023,WARDAH,L-EVCL02-W5.5G,WARDAH EVERYDAY CHEEK AND LIP TINT 02 MY BAERRY! 5.5 G,590,588,27352070,27260070,605.6851485,0.9966,2,0,92000,0,,,
21,2023,WARDAH,L-SLWCK-W,WARDAH COLORFIT LAST ALL DAY LIP PAINT 02 ETERNAL SUNSET 4.2 G,2498,2496,166651770,166516770,21049.29744,0.9992,2,0,135000,0,,,
21,2023,WARDAH,SRM-CD-W17ML,WARDAH C-DEFENSE SERUM 17 ML (PC(S)),2513,2511,204158885,203998885,4445.802344,0.9992,2,0,160000,0,,,
21,2023,WARDAH,FW-RYAG-W100ML,WARDAH RENEW YOU ANTI AGING FACIAL WASH 100 ML (PC(S)),3,1,124500,41500,,0.3333,2,0,83000,0,,,
21,2023,WARDAH,P-RPB01-W,WARDAH BUNDLING PACKAGE 1 EXCLUSIVE,14,12,2233000,1903000,,0.8571,2,0,330000,0.0001,,,
21,2023,WARDAH,L-SLWCH-W,WARDAH COLORFIT LAST ALL DAY LIP PAINT 04 BROWNDERLAST 4.2 G,2820,2818,188343060,188211060,3042.181494,0.9993,2,0,132000,0,,,
21,2023,WARDAH,L-LL07-W2.3G,WARDAH LIPSTICK LONGLASTING 07 RASPBERRY HIP 2.3 G (PC(S)),2,0,95000,0,,0,2,0,95000,0,,,
21,2023,WARDAH,L-SLWCI-W,WARDAH COLORFIT LAST ALL DAY LIP PAINT 09 TIMELESS ROSE 4.2 G,1872,1870,124803030,124665030,2435.22746,0.9989,2,0,138000,0,,,
21,2023,WARDAH,L-CLCLS1-W,WARDAH COLORFIT FRESH MATTE LIP INK 01 ENERGY SHOT 4 G,11,9,680000,558000,,0.8182,2,0,122000,0,,,
21,2023,WARDAH,L-EMCAC09-W,WARDAH EXCLUSIVE MATTE LIP CREAM X AYANG CEMPAKA 09 MAUVE ON ! 4 GR,2,0,120000,0,,0,2,0,120000,0,,,
21,2023,WARDAH,CUS-EFC03-W,WARDAH EXCLUSIVE FLAWLESS COVER CUSHION 03 SANDY BEIGE 15 G,8,7,1108000,969500,,0.875,1,0,138500,0,,,
21,2023,WARDAH,BBC-EL-W30ML,WARDAH EVERYDAY BB CREAM LIGHT 30 ML (PC(S)),1195,1194,59945755,59896355,1066.334925,0.9992,1,0,49400,0,,,
21,2023,WARDAH,L-EVCL03-W5.5G,WARDAH EVERYDAY CHEEK AND LIP TINT 03 PINK ON POINT! 5.5 G,660,659,30673565,30627565,981.6732083,0.9985,1,0,46000,0,,,
21,2023,WARDAH,CUS-REFC01-W,WARDAH REFILL EXCLUSIVE FLAWLESS COVER CUSHION 01 LIGHT BEIGE 15 G,27,26,2776500,2677000,,0.963,1,0,99500,0,,,
21,2023,WARDAH,S-NS-W170ML,WARDAH NUTRI SHINE SHAMPOO 170 ML (PC(S)),2,1,49000,24500,,0.5,1,0,24500,0,,,
21,2023,WARDAH,L-CUM06-W,WARDAH COLORFIT ULTRALIGHT MATTE LIPSTICK 06 PUNCH FUCHSIA 3.6 G,1217,1216,55726180,55680680,1483.789294,0.9992,1,0,45500,0,,,
21,2023,WARDAH,B-W3ELFP03-W30G,WARDAH EVD LUM FACE POWDER 03 IVORY 30 G (PC(S)),2364,2363,103603725,103560225,2545.468787,0.9996,1,0,43500,0,,,
21,2023,WARDAH,FM-PBTUWC-W,WARDAH C-DEFENSE WATERCLAY MASK 30 G,207,206,8571000,8530000,,0.9952,1,0,41000,0,,,
21,2023,WARDAH,L-CVM07-W,WARDAH COLORFIT VELVET MATTE LIP MOUSSE 07 RED PIONEER 4 G,2192,2191,165767000,165692000,3543.776588,0.9995,1,0,75000,0,,,
21,2023,WARDAH,EL-W1W-WTA,WARDAH EYE LINER WHITE,1,0,42500,0,,0,1,0,42500,0,,,
21,2023,WARDAH,L-CLADC01-W,WARDAH COLORFIT LAST ALL DAY LIP PAINT 00. ALLURING JAKARTA,219,218,14541000,14475000,1555.299829,0.9954,1,0,66000,0,,,
21,2023,WARDAH,L-SLWCF-W,WARDAH COLORFIT LAST ALL DAY LIP PAINT 07 BRICK ON 4.2 G,2609,2608,174043620,173977620,3000.897695,0.9996,1,0,66000,0,,,
21,2023,WARDAH,L-CLCLS2-W,WARDAH COLORFIT FRESH MATTE LIP INK 02 SMART COOKIE 4 G,1,0,67710,0,,0,1,0,67710,0,,,
21,2023,WARDAH,L-REMO36-W,WARDAH EXCLUSIVE MOIST LIPSTICK 36 SUGARY PINK 3.5 G,420,419,18519075,18475575,750.6955677,0.9976,1,0,43500,0,,,
21,2023,WARDAH,TC-R3LLF03-W,WARDAH LIGHTENING POWDER FOUNDATION LIGHT FEEL 03 SHEER PINK 12 G,5991,5990,321756210,321703210,8193.769059,0.9998,1,0,53000,0,,,
21,2023,WARDAH,MY-FWLMGWN2-W,MALAYSIA WARDAH LIGHTENING MICELLAR GENTLE WASH 100 ML,841,841,20895283.86,20895283.86,9738.259118,1,0,0,0,0,,,
21,2023,WARDAH,EB-EPBL-W,WARDAH EYEXPERT EYEBROW PENCIL BLACK 1.14 G (BLISTER),0,0,0,0,,,0,0,0,0,,,
21,2023,WARDAH,MY-FWCDEWN2-W,MALAYSIA WARDAH C-DEFENSE ENERGIZING WHIP FOAM 100 ML,36,36,1127800.08,1127800.08,1319.681338,1,0,0,0,0,,,
21,2023,WARDAH,L-CUMKORA-W,WARDAH COLORFIT ULTRALIGHT MATTE LIPSTICK 09 ROMANTIC NAMSAN 3.6 G,2515,2515,115295525,115295525,3136.015104,1,0,0,0,0,,,
21,2023,WARDAH,S-HM-W170ML,WARDAH DAILY FRESH SHAMPOO 170 ML (PC(S)),4,4,98000,98000,,1,0,0,0,0,,,
21,2023,WARDAH,DDC-CDL-W20ML,WARDAH C-DEFENSE DD CREAM LIGHT 20 ML (PC(S)),5691,5691,179790455,179790455,7278.165912,1,0,0,0,0,Bahan Baku Tudor Eboni shortage,"Bahan baku tudor eboni sudah ada kedatangan qty masih belum banyak, alokasi ke BB Cream dan DD Cream, liq found untuk produksi di W19/W20",W22
21,2023,WARDAH,MY-FTRWSABHA-W,MALAYSIA WARDAH CRYSTAL SECRET EXFOLIATING TONER WITH NATURAL AHA+PHA 125 ML,24,24,1595748,1595748,1533.769962,1,0,0,0,0,,,
21,2023,WARDAH,MY-FTRIHT-W,MALAYSIA WARDAH HYDRA ROSE PETAL INFUSED TONER 100 ML,37,37,3320192.04,3320192.04,678.62326,1,0,0,0,0,,,
21,2023,WARDAH,CUS-RREFC02-W,WARDAH REFILL EXCLUSIVE FLAWLESS COVER CUSHION 02 HONEY BEIGE 15 G,429,429,42930500,42930500,546.271246,1,0,0,0,0,,,
21,2023,WARDAH,MY-FTNDATE-W,MALAYSIA WARDAH NATURE DAILY ALOE HYDRAMILD ESSENCE TONER 100 ML,847,847,14949499.18,14949499.18,1340.310143,1,0,0,0,0,,,
21,2023,WARDAH,CUS-REFC03-W,WARDAH REFILL EXCLUSIVE FLAWLESS COVER CUSHION 03 SANDY BEIGE 15 G,33,33,3362985,3362985,,1,0,0,0,0,,,
21,2023,WARDAH,A-BPCB-W20G,WARDAH ACNEDERM PORE BLACKHEAD BALM 20 G (PC(S)),858,858,34301000,34301000,1193.115016,1,0,0,0,0,,,
21,2023,WARDAH,MY-FSRLN2-W,MALAYSIA WARDAH LIGHTENING GENTLE EXFOLIATOR 50 ML,129,129,1963253.6,1963253.6,4072.16218,1,0,0,0,0,,,
21,2023,WARDAH,L-CUMKORE-W,WARDAH COLORFIT ULTRALIGHT MATTE LIPSTICK 13 UPBEAT HONGDAE 3.6 G,3775,3775,172868510,172868510,4775.667358,1,0,0,0,0,,,
21,2023,WARDAH,L-CVM010-W,WARDAH COLORFIT VELVET MATTE LIP MOUSSE 10 LIVELY CORAL 4 G,2499,2499,189711330,189711330,3751.909509,1,0,0,0,0,,,
21,2023,WARDAH,SRM-ASRM-W,WARDAH ACNEDERM ACNE CARE SERUM 15 ML,3175,3175,222391835,222391835,6016.146343,1,0,0,0,0,,,
21,2023,WARDAH,MY-FRRRELF05-W,MALAYSIA WARDAH EXCLUSIVE LIQUID FOUNDATION 05 COFFEE BEIGE 20 ML,194,194,13930880.04,13930880.04,150.1024178,1,0,0,0,0,,,
21,2023,WARDAH,CUS-EFC04-W,WARDAH EXCLUSIVE FLAWLESS COVER CUSHION 04 NATURAL 15 G,13,13,1807500,1807500,,1,0,0,0,0,,,
21,2023,WARDAH,CUS-EFC02-W,WARDAH EXCLUSIVE FLAWLESS COVER CUSHION 02 HONEY BEIGE 15 G,7,7,969500,969500,,1,0,0,0,0,,,
21,2023,WARDAH,CUS-EFC01-W,WARDAH EXCLUSIVE FLAWLESS COVER CUSHION 01 LIGHT BEIGE 15 G,7,7,969500,969500,,1,0,0,0,0,,,
21,2023,WARDAH,MY-FRRELF04-W,MALAYSIA WARDAH EXCLUSIVE LIQUID FOUNDATION 04 NATURAL 20 ML,196,196,14074566.44,14074566.44,639.9323276,1,0,0,0,0,,,
21,2023,WARDAH,MY-FRRELF03-W,MALAYSIA WARDAH EXCLUSIVE LIQUID FOUNDATION 03 SANDY BEIGE 20 ML,162,162,11633002.92,11633002.92,657.2781709,1,0,0,0,0,,,
21,2023,WARDAH,MY-FRRELF02-W,MALAYSIA WARDAH EXCLUSIVE LIQUID FOUNDATION 02 SHEER PINK 20 ML,18,18,1293177.6,1293177.6,666.7118773,1,0,0,0,0,,,
21,2023,WARDAH,MY-FRRELF01-W,MALAYSIA WARDAH EXCLUSIVE LIQUID FOUNDATION 01 LIGHT BEIGE 20 ML,9,9,646588.8,646588.8,797.4904161,1,0,0,0,0,,,
21,2023,WARDAH,MY-FMRLN2-W,MALAYSIA WARDAH LIGHTENING BLUE CLAY MASK 50 G,73,73,1255667.16,1255667.16,3158.280774,1,0,0,0,0,,,
21,2023,WARDAH,MY-FMPBTUWC-W,MALAYSIA WARDAH C-DEFENSE WATERCLAY MASK 30 G,278,278,9784560.28,9784560.28,312.1347902,1,0,0,0,0,,,
21,2023,WARDAH,L-CVM01-W,WARDAH COLORFIT VELVET MATTE LIP MOUSSE 01 BROWN DREAMER 4 G,1147,1147,86840750,86840750,1686.955534,1,0,0,0,0,,,
21,2023,WARDAH,MY-FMILGT-W,MALAYSIA WARDAH LIGHTENING FACE MIST 60 ML,912,912,21231323.52,21231323.52,4431.337504,1,0,0,0,0,,,
21,2023,WARDAH,L-CVM02-W,WARDAH COLORFIT VELVET MATTE LIP MOUSSE 02 JOYFUL ORANGE 4 G,1142,1142,86467350,86467350,1791.471322,1,0,0,0,0,,,
21,2023,WARDAH,L-CVM03-W,WARDAH COLORFIT VELVET MATTE LIP MOUSSE 03 ROSE BALLERINA 4 G,868,868,65725070,65725070,1468.405054,1,0,0,0,0,,,
21,2023,WARDAH,L-CVM05-W,WARDAH COLORFIT VELVET MATTE LIP MOUSSE 05 ARTISAN MAUVE 4 G,2208,2208,167166080,167166080,3976.244886,1,0,0,0,0,,,
