STIC-BTIMSL2R0-WPNF,Sticker Bottom Instaperfect Mattetitude Matte Stain Lp 02 W,,,11651,34,existing,10000,0,0,No,Reguler,< 2019,2023
STIC-BTIMSL3R0-WPNF,Sticker Bottom Instaperfect Mattetitude Matte Stain Lp 03 W,,,71061,144,existing,10000,0,23,No,Reguler,< 2019,2023
STIC-BTIMSL4R0-WPNF,Sticker Bottom Instaperfect Mattetitude Matte Stain Lp 04 W,,,68323,46,existing,10000,0,45,No,Reguler,< 2019,2023
STIC-BTIMSL5R0-WPNF,Sticker Bottom Instaperfect Mattetitude Matte Stain Lp 05 W,,,10032,63,existing,,0,0,No,Reguler,< 2019,2023
STIC-BTISCEPR1-WPPSM,Stc Bot Instaperfect Spotlight Chromatic Eye Palette R1 W,,,15156,2084.246795,existing,5000,0,20,Yes,Reguler,2023,2023
STIC-BTLL10R2-W,Sticker Bottom Longlasting Lipstick 10 R2 W (Pc(s)),,,18408,51.937144,existing,5000,0,4,No,Reguler,2021,2023
STIC-BTLL11R2-W,Sticker Bottom Longlasting Lipstick 11 R2 W (Pc(s)),,,5145,12.84103455,inactive,5000,0,0,Yes,Reguler,2021,2021
STIC-BTLL12R2-W,Sticker Bottom Longlasting Lipstick 12 R2 W (Pc(s)),,,3818,25.92899293,inactive,5000,0,0,Yes,Reguler,2021,2021
STIC-BTLL17R2-W,Sticker Bottom Longlasting Lipstick 17 R2 W (Pc(s)),,,9549,204.0021748,existing,5000,0,0,Yes,Reguler,2023,2023
STIC-BTLL1R2-W,Sticker Bottom Longlasting Lipstick 01 R2 Wardah (Pc(s)),,,10783,171.9192419,existing,5000,0,0,No,Reguler,2023,2023
STIC-BTLL3R2-W,Sticker Bottom Longlasting Lipstick 03 R2 W (Pc(s)),,,6435,124.8574193,existing,5000,0,0,No,Reguler,2023,2023
STIC-BTLL8R2-W,Sticker Bottom Longlasting Lipstick 08 R2 W (Pc(s)),,,11852,187.1795848,existing,5000,0,0,Yes,Reguler,2023,2023
STIC-BTLL9R2-W,Sticker Bottom Longlasting Lipstick 09 R2 W (Pc(s)),,,8248,334.7332854,existing,5000,0,6,Yes,Reguler,2023,2023
STIC-BTLLCDPR1-MOMSF,Sticker Bottom LLC Drop-Dead Pink R1 MO,,,6005,0,inactive,0,0,0,Yes,Reguler,< 2019,< 2019
STIC-BTLLCHZR1-MOMSF,Sticker Bottom LLC Hazelnut R1 MO,,,4652,11.9809692,inactive,20000,0,0,Yes,Reguler,< 2019,2021
STIC-BTLLCMOR1-MOMSF,Sticker Bottom LLC Mad Orange R1 MO,,,6204,77,inactive,0,0,0,Yes,Reguler,< 2019,2020
STIC-BTLLCRBR1-MOMSF,Sticker Bottom LLC Red Babydoll R1 MO,,,5200,85,inactive,,0,0,Yes,Reguler,2019,2020
STIC-BTLLCSPR1-MOMSF,Sticker Bottom LLC Sweet Peach R1 MO,,,4955,16,inactive,20000,0,0,Yes,Reguler,2020,2021
STIC-BTMBSR0-MOPPSM,Sticker Bottom Moisture Balm Stick MO,,,3000,0,0,30000,0,0,Yes,Reguler,< 2019,< 2019
STIC-BTNLLP2R0-W,Sticker Bottom NFS Lightening Loose Powder 02 W (Pc(s),,,12307,13,inactive,,0,0,Yes,Reguler,< 2019,< 2019
STIC-BTNLLP3R0-W,Sticker Bottom NFS Lightening Loose Powder 03 W (Pc(s),,,8675,13,inactive,,0,0,Yes,Reguler,< 2019,< 2019
STIC-BTOR3-MO,Sticker Back Toner R3 MO (Pc(s)),,,9118,1239.883156,inactive,5000,0,0,Yes,Reguler,2021,2022
STIC-BTPEPR0-MOPSM,Sticker Bottom Powerstay Eyeshadow Primer MO (Pc(s)),,,2553,57,existing,4000,0,0,Yes,Reguler,2022,2023
STIC-BTPLTCR0-MO,Sticker Bottom PSG Lip Top Coat MO (Pc(s)),,,6212,23.99516671,existing,3000,0,14,No,Reguler,2023,2023
STIC-BTPMPFC21R-MOSC,Sticker Bottom Powerstay Matte Powder Foundation C21 MO,,,8363,150,existing,3000,0,28,No,Reguler,2023,2023
STIC-BTPMPFC62R-MOSC,Sticker Bottom Powerstay Matte Powder Foundation C62 MO,,,7740,256.4497182,existing,3000,0,0,No,Reguler,2021,2023
STIC-BTPMPFN10R-MOSC,Sticker Bottom Powerstay Matte Powder Foundation N10 MO,,,14311,249.8961206,existing,3000,10000,16,No,Reguler,2023,2023
STIC-BTPMPFN30R-MOSC,Sticker Bottom Powerstay Matte Powder Foundation N30 MO,,,20391,303.113764,existing,3000,15000,0,No,Reguler,2023,2023
STIC-BTPMPFW22R-MOSC,Sticker Bottom Powerstay Matte Powder Foundation W22 MO,,,28355,266.6048342,existing,3000,24500,67,No,Reguler,2023,2023
STIC-BTPMPFW33R-MOSC,Sticker Bottom Powerstay Matte Powder Foundation W33 MO,,,17809,287.3265709,existing,3000,14000,29,No,Reguler,2023,2023
STIC-BTPMPFW41R-MOSC,Sticker Bottom Powerstay Matte Powder Foundation W41 MO,,,7090,147.7579738,existing,3000,3000,134,No,Reguler,2023,2023
STIC-BTPMPFW42R-MOSC,Sticker Bottom Powerstay Matte Powder Foundation W42 MO,,,4387,99.86277258,existing,3000,3000,43,No,Reguler,2023,2023
STIC-BTPMTPR0-MOPPWD,Sticker Bottom Powerstay Mattifying Transparent Powder MO,,,8920,283.7402845,existing,10000,0,57,No,Reguler,2023,2023
STIC-BTPRTM10L-MOSM,Sticker Bottom Powerskin RTM 10 Light MO (Pc(s)),,,8130,87.23171389,existing,5000,0,0,No,Reguler,< 2019,2023
STIC-BTPRTM20LB-MOSM,Sticker Bottom Powerskin RTM 20 Light Beige MO (Pc(s)),,,12314,101.1679587,existing,5000,0,0,No,Reguler,2021,2023
STIC-BTPRTM30B-MOSM,Sticker Bottom Powerskin RTM 30 Beige MO (Pc(s)),,,11391,96,existing,5000,0,0,Yes,Reguler,2020,2023
STIC-BTPRTM40MB-MOSM,Sticker Bottom Powerskin RTM 40 Medium Beige MO (Pc(s)),,,21588,56,existing,5000,0,0,Yes,Reguler,< 2019,2023
STIC-BTPUGHR0-MOSCD,Sticker Bottom Powerstay Ultra Glow Highlighter MO,,,2346,460.9789295,existing,5000,0,0,No,Reguler,2020,2023
STIC-BTPVLS1R0-MO,Sticker Bottom Powerstay VW Lip Stain 01 MO (Pc(s)),,,26300,33,existing,5000,0,0,Yes,Reguler,2020,2022
STIC-BTPVLS2R0-MO,Sticker Bottom Powerstay VW Lip Stain 02 MO (Pc(s)),,,6061,24,existing,5000,0,0,Yes,Reguler,2022,2022
STIC-BTPVLS3R0-MO,Sticker Bottom Powerstay VW Lip Stain 03 MO (Pc(s)),,,14596,46.2161781,existing,5000,0,0,Yes,Reguler,2022,2022
STIC-BTPVLS4R0-MO,Sticker Bottom Powerstay VW Lip Stain 04 MO (Pc(s)),,,5271,33,existing,5000,0,0,Yes,Reguler,2021,2023
STIC-BTPVLS5R0-MO,Sticker Bottom Powerstay VW Lip Stain 05 MO (Pc(s)),,,5803,34.87682333,existing,5000,0,0,Yes,Reguler,2023,2023
STIC-BTPVLS6R0-MO,Sticker Bottom Powerstay VW Lip Stain 06 MO (Pc(s)),,,29563,33,existing,5000,0,0,Yes,Reguler,2020,2022
STIC-BTPVLS7R0-MO,Sticker Bottom Powerstay VW Lip Stain 07 MO (Pc(s)),,,56201,33,existing,5000,0,0,No,Reguler,2021,2023
STIC-BTPVLS8R0-MO,Sticker Bottom Powerstay VW Lip Stain 08 MO (Pc(s)),,,21739,44,existing,5000,0,0,Yes,Reguler,2020,2023
STIC-BTSBSO2R2-W240,Sticker Bottom SBS Olive 240 ROLL R2 W (Pc(s)),,,10437,1072.764342,existing,5000,0,0,No,Reguler,2023,2023
STIC-BTSBSOR2-W150,Sticker Bottom SBS Olive 150 ROLL R2 W (Pc(s)),,,17565,1075.051426,existing,5000,0,0,Yes,Reguler,2023,2023
STIC-BTSBSPFR2-W150,Sticker Bottom SBS Passion 150 ROLL R2 W (Pc(s)),,,10865,1429.410786,existing,5000,0,0,Yes,Reguler,2023,2023
STIC-BTSBSSR2-W150,Sticker Bottom SBS Strawberry 150 ROLL R2 W,,,7946,590.3527607,existing,5000,0,0,Yes,Reguler,2023,2023
STIC-BTSFLPRR1-E,Sticker Bottom Sebum Fighter Loose Powder R1 Roll E (Pc(s),,,9551,115.9663039,existing,5000,0,77,No,Reguler,2023,2023
STIC-BTSPBRR2-MOPSM,Sticker Bottom Shimmering Powder Bronzed Repackage R2 MO,,,17448,87,existing,2000,0,20,Yes,Reguler,< 2019,2023
STIC-BTSPCRR2-MOPSM,Sticker Bottom Shimmering Powder Chrystalist Repackage R2MO,,,128802,174,existing,2000,0,0,No,Reguler,< 2019,2023
STIC-BTSPGRR2-MOPSM,Sticker Bottom Shimmering Powder Goldinx Repackage R2 MO,,,16203,174,existing,2000,0,19,No,Reguler,< 2019,2023
STIC-BTSPQRR2-MOPSM,Sticker Bottom Shimmering Powder Quartza Repackage R2 MO,,,15775,261,existing,2000,0,64,No,Reguler,< 2019,2023
STIC-BTTBSPBR0-ECNF,Sticker Bottom OSK Tinted Balm Stick Pink Bonbons E (Pc(s)),,,21447,466.2505765,existing,5000,0,13,No,Reguler,2023,2023
STIC-BTTBSPCR0-ECNF,Sticker Bottom OSK Tinted Balm Stick Plum Candy E (Pc(s)),,,48731,448.6030926,existing,5000,30000,87,No,Reguler,2023,2023
STIC-BTUHM1R1-MOMSF,Sticker Bottom UHM 001 R1 MO,,,7759,39,inactive,,0,0,Yes,Reguler,< 2019,2022
STIC-BTUHM2R1-MOMSF,Sticker Bottom UHM 002 R1 MO,,,10088,0,inactive,,0,0,Yes,Reguler,< 2019,2022
STIC-BTUHM3R1-MOMSF,Sticker Bottom UHM 003 R1 MO,,,4922,12,inactive,20000,0,0,Yes,Reguler,< 2019,2020
STIC-BTUHM4R1-MOMSF,Sticker Bottom UHM 004 R1 MO,,,12924,22.75597218,inactive,20000,0,0,Yes,Reguler,< 2019,2022
STIC-BTUHM5R1-MOMSF,Sticker Bottom UHM 005 R1 MO,,,10496,33,inactive,20000,0,0,Yes,Reguler,< 2019,2022
STIC-BTUHM6R1-MOMSF,Sticker Bottom UHM 006 R1 MO,,,5588,11,inactive,20000,0,0,Yes,Reguler,< 2019,2022
STIC-BTYZBW-BD,Sticker Back Tester YZBW 60 BD,,,662,1000,existing,2300,265,0,Yes,Reguler,2023,2022
STIC-BWLS01R0-E,Sticker Bottom Watercolor Lip Serum 01 E,,,74277,131.937396,existing,10000,55000,0,No,Reguler,2023,2023
STIC-BWLS02R0-E,Sticker Bottom Watercolor Lip Serum 02 E,,,66875,77.28833406,existing,10000,50000,30,No,Reguler,2023,2023
STIC-BWLS03R0-E,Sticker Bottom Watercolor Lip Serum 03 E,,,21298,309.4227274,existing,10000,5000,16,No,Reguler,2023,2023
STIC-BWLS04R0-E,Sticker Bottom Watercolor Lip Serum 04 E,,,19160,160.3116699,existing,10000,0,18,No,Reguler,2023,2023
STIC-BWSSW-W,Sticker Bundling White Secret Series Watsons W,,,28,1350,inactive,0,0,0,Yes,Reguler,< 2019,2021
STIC-CCBBMP50R1-W,Sticker Cover Creamy Body Butter Milk & Pearl 50 R1 W,,,5000,242,0,5000,5000,0,Yes,,2023,< 2019
STIC-CCTSMRR0-E,Sticker Cover Capsule Treat Sleeping Mask Rice Emina,,,4260,200,inactive,15000,0,0,Yes,Reguler,2021,2021
STIC-CDPR22-W,Sticker Crystallure Decorative Package Ramadhan 2022 W,,,31,1375,new product,1000,0,0,Yes,Reguler,2022,2022
STIC-CNDAACMR1-W,Sticker Cover ND Alpine Apple Nutritive Gel Capsule Mask W,,,21934,1098.540976,existing,10000,0,0,Yes,Reguler,2023,2023
STIC-CNDABCMR0-W,Sticker Cover ND Amazonian Acai Berry Antiox Capsule Mask W,,,12735,917.6979748,existing,10000,0,0,Yes,Reguler,2023,2022
STIC-CNDMOCMR0-W,Sticker Cover ND Milky Oat Exfoliating Scrub Capsule Mask W,,,19041,509.9637713,existing,10000,0,0,Yes,Reguler,2023,2023
STIC-CNDOPCMR0-W,Sticker Cover ND Orange Pom Bright Wash Off Capsule Mask W,,,14350,297.6163306,existing,10000,0,30,Yes,Reguler,2021,2023
STIC-CNDTTCMR0-W,Sticker Cover ND Tea Tree Oil Control Clay Capsule Mask W,,,25352,1298.172805,existing,10000,0,0,Yes,Reguler,2023,2023
STIC-COCBBLG15-R2PP,Sticker Cover CBB Lavender 150 ROLL R2 W (Pc(s)),,,27709,1538.136122,inactive,5000,0,0,Yes,Reguler,< 2019,2022
STIC-COCBBLG50-R2PP,Sticker Cover CBB Lavender 50 ROLL R2 W (Pc(s)),,,3834,284,inactive,5000,0,0,No,Reguler,2021,2023
STIC-COCBBMP15-R2PP,Sticker Cover CBB Milk 150 ROLL R2 W,,,18696,330,inactive,5000,0,0,Yes,Reguler,2020,< 2019
STIC-COCBBPF15-R2PP,Sticker Cover CBB Passion 150 ROLL R2 W (Pc(s)),,,12459,765.4852321,inactive,5000,0,0,Yes,Reguler,2020,2022
STIC-COCBBPF50-R2PP,Sticker Cover CBB Passion 50 ROLL R2 W,,,3080,142,0,0,0,0,Yes,Reguler,2020,< 2019
STIC-COCBBR50-R2PP,Sticker Cover CBB Rose 50 ROLL R2 W,,,12044,478.800648,existing,5000,0,0,No,Reguler,2023,2023
STIC-COCBBST15-R2PP,Sticker Cover CBB Strawberry 150 ROLL R2 W,,,15000,420,inactive,5000,0,0,Yes,Reguler,2020,< 2019
STIC-COVCBBMP15-R1PP,Sticker Sticker Cover CBB Milk 150 ROLL W Wardah,,,139,900,inactive,,0,0,Yes,Reguler,< 2019,2022
STIC-COVCBBMP50-R1PP,Sticker Sticker Cover CBB Milk 50 ROLL W Wardah,,,2495000,181.4135267,existing,5000,0,0,No,Reguler,2022,2023
STIC-COVCBBOL15-R1PP,Sticker Sticker Cover CBB Olive 150 ROLL W Wardah,,,24700,154.2086265,inactive,,0,0,Yes,Reguler,< 2019,2022
STIC-COVCBBOL50-R1PP,Sticker Sticker Cover CBB Olive 50 ROLL W Wardah,,,7605,1101.426996,existing,5000,0,0,No,Reguler,2023,2023
STIC-COVCBBPF50-R1PP,Sticker Sticker Cover CBB Passion 50 ROLL W Wardah,,,15680,936.2794117,existing,5000,10000,0,No,Reguler,2023,2023
STIC-COVCBBS10-PPW6,Sticker Cover Creamy Body Butter Strawberry 100 Wardah,,,5000,0,0,,0,0,Yes,Reguler,< 2019,< 2019
STIC-COVCBBST15-R1PP,Sticker Sticker Cover CBB Strawberry 150 ROLL W Wardah,,,220,165.5615869,inactive,,0,0,Yes,Reguler,< 2019,2021
STIC-COVCBBST50-R1PP,Sticker Sticker Cover CBB Strawberry 50 ROLL W Wardah,,,16725,284,existing,5000,0,0,No,Reguler,< 2019,2023
STIC-COVSBSOL15-R1PP,Sticker Sticker Cover SBS Olive 150 ROLL W Wardah,,,16318,1786.906202,existing,5000,0,0,No,Reguler,2023,2023
STIC-COVSBSOL24-R1PP,Sticker Sticker Cover SBS Olive 240 ROLL W Wardah,,,11677,1357.86915,existing,5000,0,0,No,Reguler,2023,2023
STIC-COVSBSPF15-R1PP,Sticker Sticker Cover SBS Passion 150 ROLL W Wardah,,,11486,1055.738378,existing,5000,0,0,Yes,Reguler,2023,2023
STIC-CSBSSR2-W150,Sticker Cover SBS Strawberry 150 R2 W,,,9980,712.6276804,existing,5000,0,0,Yes,Reguler,2023,2023
STIC-CSPR22-W,Sticker Crystallure Skincare Package Ramadhan 2022 W,,,70,1365,inactive,2000,0,0,Yes,Reguler,2022,2022
STIC-DIYRP23-W,Sticker DIY Ramadhan Package 2023 W,,,1685,1260,new product,35000,0,0,Yes,NPD,2023,2023
STIC-EAHMG100RV-W,Sticker Eyecatch Hydramild Multifunction Gel 100 RV W,,,156465,70,new product,100000,0,0,No,Reguler,2023,2023
STIC-EBSFW50-E,Sticker Eyecatch Bright Stuff Face Wash 50 ml E,,,19900,41.13543625,existing,,0,0,Yes,Reguler,2021,2021
STIC-ECAHFW100-W,Sticker Eyecatch AHFW 100 W,,,16260,220,existing,85000,0,0,Yes,Reguler,2020,2021
STIC-ECAHMGR1-WPSB,Sticker Eyecatch AHMG 100 R1 W,,,5307,121.5917263,existing,50000,0,0,Yes,Reguler,2022,2023
STIC-ECCABE30-W,Sticker Eyecatch Crystallure ABE 30 ml Wardah,,,20854,2240,existing,10000,0,0,No,Reguler,2023,2023
STIC-ECCSBDC30-W,Sticker Eyecatch CS BDC 30 W,,,276903,957.2077179,existing,40000,0,0,Yes,Reguler,2021,2021
STIC-ECCSROS30-W,Sticker Eyecatch Crystallure SROS 30 ml Wardah,,,19437,1107.530576,existing,10000,0,0,No,Reguler,2023,2023
STIC-ECGEFS100R0-K,Sticker Eyecatch GE Face Scrub 100 K,,,7532,135,existing,50000,0,0,Yes,Reguler,2021,2022
STIC-ECLIR0-W,Sticker Eyecatch Colorfit Lip Ink W,,,53921,235.8152681,existing,30000,0,0,No,Reguler,2023,2023
STIC-ECLVMR0-E,Sticker Eyecatch Cosmic Lash Volume Mascara E,,,102434,547.201016,new product,20000,0,0,Yes,NPD,2023,2023
STIC-ECOACFW100R0-K,Sticker Eyecatch OAC Face Wash 100 K,,,2074,135,existing,50000,0,0,Yes,Reguler,2022,2022
STIC-ECPBCFBOCRV100-W,Sticker Eyecatch PBCF Oil Control 100 W,,,700,94,new product,100000,0,0,Yes,Reguler,2022,2022
STIC-ECPBCFBSGRV100-W,Sticker Eyecatch PBCF Smooth Glow 100 W,,,4730,188,new product,100000,0,0,Yes,Reguler,2022,2022
STIC-ECPBCFBSGRV50-W,Sticker Eyecatch PBCF Smooth Glow 50 W,,,21223,80,new product,100000,0,0,Yes,Reguler,2022,2022
STIC-ECSEBFW100R0-K,Sticker Eyecatch SEB Face Wash 100 K,,,20123,135,existing,50000,0,0,Yes,Reguler,2022,2022
STIC-ECSW-WPSB,Sticker Eyecatch Shampoo W,,,17150,31.08154245,inactive,300000,0,0,Yes,Reguler,2022,2022
STIC-ECTAOCDFW100R0-K,Sticker Eyecatch TAOCD Face Wash 100 R0 K,,,100,0,new product,30000,0,0,Yes,Reguler,2022,2022
STIC-EDTHF2R1-K,Sticker Samping EDT 1.7 HF R1 K,,,152,126,inactive,2500,0,0,Yes,Reguler,2020,2020
STIC-EDTRO2R1-K,Sticker Samping EDT 1.7 RO R1 K,,,159,126,inactive,2500,0,0,Yes,Reguler,2020,2020
STIC-EDTTB2R1-K,Sticker Samping EDT 1.7 TB R1 K,,,195,126,inactive,2500,0,0,Yes,Reguler,2020,2020
STIC-ELGE50-W,Sticker Eyecatch Lightening Gentle Exfoliator 50 W,,,251009,150,existing,100000,0,0,No,Reguler,2022,2023
STIC-ENFSBSFW-E,Sticker Eyecatch NFS Bright Stuff Face Wash E,,,11624,443.2772166,new product,20000,0,0,No,One Shot,2023,2023
STIC-EPRD22-E,Sticker Emina Package Ramadhan Decorative 2022 E,,,452,1000,inactive,4000,0,0,Yes,Reguler,2021,2022
STIC-EPRM22-E,Sticker Emina Package Ramadhan Mix 2022 E,,,357,1000,existing,4000,0,0,Yes,Reguler,2021,2022
STIC-EPRS22-E,Sticker Emina Package Ramadhan Skincare 2022 E,,,545,1000,existing,4000,0,0,Yes,Reguler,2021,2022
STIC-ERYFW100R0-W,Sticker Eyecatch Renew You Facial Wash 100 W,,,1815,109.4578746,new product,100000,0,0,Yes,Reguler,2022,2022
STIC-ESTSBMO-PSM1W42,Sticker Bottom Trivia ES Skycrapping Blue Make over,,,3156,61,existing,20000,0,0,No,Reguler,2022,2023
STIC-EYECWTSN-WM,Sticker Eyecatch Watson WM,,,11396,120,new product,20000,0,0,Yes,Reguler,2022,2023
STIC-FAHHS100-WM,Sticker Front AH Hand Sanitizer WM,,,142,540,inactive,20000,0,0,Yes,Ex Revamp,2020,2020
STIC-FAPRT100-WGCE,Sticker Front Acnederm Pore Refining Toner 100 W,,,83567,899.8754241,existing,20000,60000,0,No,Reguler,2023,2023
STIC-FAPSR1-MO,Sticker Front APS R1 MO,,,10714,885,existing,10000,0,0,Yes,Reguler,2022,2023
STIC-FBBLA-WL,Sticker Front & Back BL Amore WL,,,14839,1680,new product,10000,0,0,Yes,Reguler,2022,2023
STIC-FBBLF-WL,Sticker Front & Back BL Fearless WL,,,17165,1680,new product,25000,0,0,Yes,Reguler,2022,2023
STIC-FBBLM-WL,Sticker Front & Back BL Mode WL,,,20048,560,new product,25000,0,30,No,Reguler,2022,2023
STIC-FBBLR-WL,Sticker Front & Back BL Royale WL,,,21402,1120,new product,25000,0,0,Yes,Reguler,2022,2023
STIC-FBBLV-WL,Sticker Front & Back BL Voyage WL,,,17924,2240,new product,25000,0,0,No,Reguler,2022,2023
STIC-FBMBLSR0-ELL,Sticker Front EB Bamboo & O Mint BLS 250 ELL,,,13767,500,new product,20000,0,0,Yes,NPD,2022,2023
STIC-FBMBW250R0-ELL,Sticker Front EB Bamboo & O Mint W BWash 250 ELL,,,15983,1500,new product,20000,0,0,Yes,NPD,2022,2023
STIC-FBMBW450R0-ELL,Sticker Front EB Bamboo & O Mint BWash 450 ELL,,,12521,600,new product,20000,0,0,Yes,NPD,2022,2023
STIC-FBSMW100-E,Sticker Front BS Micellar Water 100 E,,,104516,1129.804996,existing,50000,0,0,No,Reguler,2023,2023
STIC-FBSMW50-E,Sticker Front BS Micellar Water 50 E,,,40581,414.977702,existing,50000,0,0,No,Reguler,2023,2023
STIC-FBWGT550-BD,Sticker Front Body Wash Green Tea 550 BD,,,49780,1425,new product,15000,0,0,Yes,NPD,2023,2023
STIC-FBWMGTJ5-BD,Sticker Front Body Wash Mint + Green Tea Jerrycan 5L BD,,,30,0,new product,30,0,0,Yes,Reguler,< 2019,< 2019
STIC-FBWMGTR0-BD,Sticker Front Body Wash Mint + Green Tea BD,,,33872,1360,existing,20000,0,0,No,Reguler,2023,2023
STIC-FBWMSSJ5-BD,Sticker Front Body Wash Mint + Sea Salt Jerrycan 5L BD,,,30,0,new product,30,0,0,Yes,Reguler,< 2019,< 2019
STIC-FBWMSSR0-BD,Sticker Front Body Wash Mint + Sea Salt BD,,,25879,2040,existing,20000,0,0,No,Reguler,2023,2023
STIC-FBWMYZJ5-BD,Sticker Front Body Wash Mint + Yuzu Jerrycan 5L BD,,,30,0,new product,30,0,0,Yes,Reguler,< 2019,< 2019
STIC-FBWMYZR0-BD,Sticker Front Body Wash Mint + Yuzu BD,,,26442,1020,existing,20000,0,0,Yes,Reguler,2023,2023
STIC-FBWSS550-BD,Sticker Front Body Wash Sea Salt 550 BD,,,19240,475,new product,15000,0,0,Yes,NPD,2023,2023
STIC-FBWYZ550-BD,Sticker Front Body Wash Yuzu 550 BD,,,29740,950,new product,15000,0,0,Yes,NPD,2023,2023
STIC-FCLF13CIR0-OMG,Sticker Front Coverlast Liquid Foundation 25 mL 13 C Ivory OMG,,OMG,322,9800835.644,new product,1,79000,0,Yes,NPD,2023,2023
STIC-FCLF21WLR0-OMG,Sticker Front Coverlast Liquid Foundation 25 mL 21 W Light OMG,Pc(s),OMG,0,11570384.78,new product,1,130000,0,Yes,NPD,2023,2022
STIC-FCLF31WBR0-OMG,Sticker Front Coverlast Liquid Foundation 25 mL 31 W Beige OMG,Pc(s),OMG,0,10227570.59,new product,1,123000,0,Yes,NPD,2023,2023
STIC-FCLF32NNR0-OMG,Sticker Front Coverlast Liquid Foundation 25 mL 32 N Natural OMG,Pc(s),OMG,0,10460689.38,new product,1,155500,0,Yes,NPD,2023,2022
STIC-FCLF41WSR0-OMG,Sticker Front Coverlast Liquid Foundation 25 mL 41 W Sand OMG,Pc(s),OMG,0,13099718.12,new product,1,90000,0,Yes,NPD,2023,2023
STIC-FCLF52NCR0-OMG,Sticker Front Coverlast Liquid Foundation 25 mL 52 N Caramel OMG,,OMG,3475,10406795.19,new product,1,45000,0,Yes,NPD,2023,2023
STIC-FCSMCGR0-W,Sticker Front CS Micellar Cleansing Gel 95 W,,,13800,205,to be discontinued,30000,0,0,Yes,Reguler,2021,2023
STIC-FCSMCGR1-W,Sticker Front CS Micellar Cleansing Gel 95 R1 W,,,50155,1570.015661,existing,30000,0,0,No,Reguler,2023,2023
STIC-FDROR1-K,Sticker Front Deo Roll On R1 K,,,33106,240,existing,10000,30000,0,No,Reguler,2023,2023
STIC-FELFR0-W,Sticker Front Exclusive Liquid Foundation W,,,186164,505.4174143,new product,10000,178920,140,No,Reguler,2023,2023
STIC-FELM01FR0-W,Sticker Front Everyday Luminous Liquid Foundation Repack 01 Natural White 35 W,,,146537,667.5449631,existing,25000,85000,0,No,Reguler,2023,2023
STIC-FELM02FR0-W,Sticker Front Everyday Luminous Liquid Foundation Repack 02 Light Beige 35 W,,,149457,586.5142858,existing,25000,105000,0,No,Reguler,2023,2023
STIC-FELM03FR0-W,Sticker Front Everyday Luminous Liquid Foundation Repack 03 Beige 35 W,,,66820,324.1667235,existing,25000,0,0,No,Reguler,2023,2023
STIC-FELM04FR0-W,Sticker Front Everyday Luminous Liquid Foundation Repack 04 Natural 35 W,,,65982,373.7577652,existing,25000,35000,0,No,Reguler,2023,2023
STIC-FEMRSR1-K,Sticker Front EM Refreshing Spray 100 R1 K,,,5782,720,existing,5000,0,0,No,Reguler,2023,2023
STIC-FFCBGSR0-ELL,Sticker Front SB Frangipani & T Coconut W BGS 250 ELL,,,14763,500,new product,20000,0,50,Yes,NPD,2022,2023
STIC-FFCBW250R0-ELL,Sticker Front SB Frangipani & T Coconut W BWash 250 ELL,,,14085,1000,new product,20000,0,0,Yes,NPD,2022,2023
STIC-FFCBW450R0-ELL,Sticker Front SB Frangipani & T Coconut W BWash 450 ELL,,,13432,600,new product,20000,0,0,Yes,NPD,2022,2023
STIC-FGBBC40-L,Sticker Front GB Body Care 40 L,,,9404,330,new product,20000,0,0,No,,2023,2023
STIC-FGBMC100R0-L,Sticker Front GB Mild Cleanser 100 L,,,43773,555,existing,10000,0,0,Yes,Reguler,2023,2022
STIC-FHWMGTJ5-BD,Sticker Front Hand Wash Mint + Green Tea Jerrycan 5L BD,,,70,0,new product,30,0,0,Yes,Reguler,< 2019,< 2019
STIC-FHWMGTR0-BD,Sticker Front Hand Wash Mint + Green Tea BD,,,15148,764.6750997,existing,10000,0,80,No,Reguler,2023,2023
STIC-FHWMYZJ5-BD,Sticker Front Hand Wash Mint + Yuzu Jerrycan 5L BD,,,70,0,new product,30,0,0,Yes,Reguler,< 2019,< 2019
STIC-FHWMYZR0-BD,Sticker Front Hand Wash Mint + Yuzu BD,,,6868,1923.417211,existing,10000,0,0,No,Reguler,2023,2023
STIC-FLMPOIW50R1-W,Sticker Front Lightening MOIW 50 R1 W,,,6872,244.1004544,existing,20000,0,0,Yes,Reguler,2022,2023
STIC-FLRMBLSR0-ELL,Sticker Front S Lavender & J Rice Milk BLS 250 ELL,,,15163,1000,new product,20000,0,0,Yes,NPD,2022,2023
STIC-FLRMBW250R0-ELL,Sticker Front S Lavender & J Rice Milk BWash 250 ELL,,,14903,1000,new product,20000,0,0,Yes,NPD,2022,2023
STIC-FLRMBW450R0-ELL,Sticker Front S Lavender & J Rice Milk BWash 450 ELL,,,14087,600,new product,20000,0,0,Yes,NPD,2022,2023
STIC-FMSBLSR0-ELL,Sticker Front J Moringa & B Starfruit BLS 250 ELL,,,14163,1000,new product,20000,0,0,Yes,NPD,2022,2023
STIC-FMSBW250R0-ELL,Sticker Front J Moringa & B Starfruit BWash 250 ELL,,,15489,500,new product,20000,0,0,Yes,NPD,2022,2023
STIC-FMSBW450R0-ELL,Sticker Front J Moringa & B Starfruit BWash 450 ELL,,,6489,1200,new product,20000,0,0,Yes,NPD,2022,2022
STIC-FMURR3-MO,Sticker Front MUR R3 MO (Pc(s)),,,7659,667.3713222,existing,5000,0,0,No,Reguler,2023,2023
STIC-FMWBS100R1-EVG,Sticker Front Micellar Water DC Bright Stuff Emina R1 ROLL,,,26340,200,inactive,10000,0,0,Yes,Reguler,2021,2021
STIC-FNDAH250R0-W,Sticker Front NDAH Body Wash 250 W,,,6000,475,inactive,50000,0,0,Yes,Reguler,2020,2020
STIC-FNDAH250R1-W,Sticker Front NDAH Body Wash 250 R1 W,,,11350,712.5,inactive,,0,0,Yes,Ex Revamp,2021,2021
STIC-FNDAHET100-W,Sticker Front NDAH Essence Toner 100 W,,,80978,1155.72202,existing,25000,0,0,No,Reguler,2023,2023
STIC-FNDAHHW250R1-W,Sticker Front NDAH Hand Wash 250 R1 W,,,62402,393.2258463,existing,,0,0,Yes,Ex Revamp,2021,2021
STIC-FRLOIMWN1-W,Sticker Front Lightening Oil-infused Micellar Water 55 R W,,,128941,729.7165282,new product,50000,0,0,No,Reguler,2023,2023
STIC-FRLOIMWN2-W,Sticker Front Lightening Oil-infused Micellar Water 105 R W,,,154763,724.7428122,new product,30000,0,0,No,Reguler,2023,2023
STIC-FROFHER5-W,Sticker Front RO For Her R5 W (Pc(s)),,,92119,224.8901379,existing,10000,0,0,No,Reguler,2023,2023
STIC-FRVBLSR0-ELL,Sticker Front B Rose & EN Vanilla BLS 250 ELL,,,14252,1000,new product,20000,0,0,Yes,NPD,2022,2023
STIC-FRVBW250R0-ELL,Sticker Front B Rose & EN Vanilla BWash 250 ELL,,,15339,500,new product,20000,0,0,Yes,NPD,2022,2023
STIC-FRVBW450R0-ELL,Sticker Front B Rose & EN Vanilla BWash 450 ELL,,,14498,600,new product,20000,0,0,Yes,NPD,2022,2023
STIC-FRVPBMW100-W,Sticker Front Perfect Bright Micellar Water RV 100 W,,,29016,1196.358404,to be discontinued,100000,0,0,No,Reguler,2023,2023
STIC-FSBMW100-E,Sticker Front SB Micellar Water 100 E,,,40584,532.2613041,existing,10000,0,0,No,Reguler,2023,2023
STIC-FSBMW50-E,Sticker Front SB Micellar Water 50 E,,,80611,669.9548081,existing,25000,0,0,Yes,Reguler,2023,2023
STIC-FSCMW100R5-W,Sticker Front SC Micellar Water 100 W R5 ROLL,,,100040,2214.394121,existing,20000,49000,0,No,Reguler,2023,2023
STIC-FSCMW240R5-W,Sticker Front SC Micellar Water 240 W R5 ROLL,,,43362,1413.721863,existing,60000,0,0,No,Reguler,2023,2023
STIC-FSCMWR0-WCOC,Sticker Sticker Front SC Micellar Water W ROLL Wardah,,,20000,225,inactive,,0,0,Yes,Reguler,< 2019,< 2019
STIC-FSPSHBR1-WGCC,Sticker Front Seaweed PSH Booster R1 W ROLL,,,2550,153.5526748,existing,30000,0,0,Yes,Reguler,2021,2021
STIC-FTGTBW-BD,Sticker Front Tester GTBW 60 BD,,,40,1000,existing,2300,195,0,No,Reguler,2023,2023
STIC-FTYZBW-BD,Sticker Front Tester YZBW 60 BD,,,662,1000,existing,2300,265,0,Yes,Reguler,2023,2022
STIC-GBMC225R0-L,Sticker Label GB Mild Cleanser 225 L,,,276,850,to be discontinued,10000,0,0,Yes,Reguler,2022,2022
STIC-GBMC225R1-L,Sticker Label GB Mild Cleanser 225 R1 L,,,17182,4250,existing,10000,0,0,Yes,Reguler,2023,2023
STIC-GOSS-MO,Sticker Gala Of Stars Secret MO,,,106,1155,new product,2000,0,0,Yes,Reguler,2023,2023
STIC-HEMLCR1-W,Sticker Hologram Exclusive Matte Lip Cream R1 W,,,1155294,770.1371318,existing,1000000,80000,222,No,NPD,2023,2023
STIC-HSWR0-WL,Sticker Hologram Wonderly,,,83975,133.5557284,new product,100000,0,0,No,Reguler,2022,2023
STIC-ILSCP-WPPNF,Sticker Ingredients LSCP Carnation Pink Emina,,,4031,247.9873453,inactive,1000,0,0,Yes,Reguler,2021,2021
STIC-ILSCR-WPPNF,Sticker Ingredients LSCR Cerise Red Emina,,,2247,231,inactive,1000,0,0,Yes,Reguler,2022,2022
STIC-IMHC20-W,Sticker Samping Intensive Moisturizer 20 W,,,14159,761.3975824,new product,5000,10000,21,No,Reguler,2023,2023
STIC-L007UHMM-PPSM1,Sticker Lipstick 007 Ultra Hi-Matte Make over,,,5975,106,inactive,1000,0,0,Yes,Reguler,< 2019,2022
STIC-LBLNMCR1-MOMSF,Sticker Bottom LBLN Melon R1 MO,,,6398,207.7202073,existing,5000,0,15,No,Reguler,2023,2023
STIC-LBLNOCR1-MOMSF,Sticker Bottom LBLN Orange R1 MO,,,6905,219.2368291,existing,5000,0,16,No,Reguler,2023,2023
STIC-LBLNVLR1-MOMSF,Sticker Bottom LBLN Vanilla R1 MO,,,5507,705.489774,existing,30000,0,0,No,Reguler,2023,2023
STIC-LLCDDPMO-PPSM1W,Sticker Liquid Lip Color Drop Dead Pink Make over,,,4785,28,inactive,,0,0,Yes,Reguler,< 2019,2021
STIC-LLCRTMO-PPSM1WD,Sticker Liquid Lip Color Red Temptation Make over,,,5,33.5,inactive,,0,0,Yes,Reguler,< 2019,2021
