Code,Product,Quantity on Hand,Reserved,Available
00004,Acne Perfecting Moisurizer Gel Wardah 40 ml (Pc(s)),7.0,0.0,7.0
00009,Wardah Roll On For Her 60 ml,19230.0,690.0,18540.0
00011,Wardah C-Defense DD Cream Light 20 ml (Pc(s)),10080.0,3708.0,6372.0
00012,Wardah C-Defense DD Cream Natural 20 ml (Pc(s)),12636.0,10404.0,2232.0
00013,Wardah C-defense Serum 17 ml (Pc(s)),34440.0,300.0,34140.0
00036,"Wardah Lipstick Exclusive 31 Rose Wood 3,8 gr",768.0,0.0,768.0
00041,"Wardah Lipstick Exclusive 36 Sugary Pink 3,8 gr",2.0,0.0,2.0
00059,Wardah Exclusive Liquid Foundation 04 Natural 20 ml,1.0,0.0,1.0
00071,Wardah EyeXpert Aqua Lash Mascara 6 gr (Pc(s)),23856.0,1296.0,22560.0
00072,Wardah EyeXpert Eye & Lip Makeup Remover 50 ml,9030.0,126.0,8904.0
00073,Wardah EyeXpert Eye & Lip Makeup Remover 100 ml,11441.0,1530.0,9911.0
00076,Wardah EyeXpert Optimum Hi-Black Liner 1 gr (Pc(s)),76318.0,2800.0,73518.0
00077,Wardah EyeXpert Perfectcurl Mascara 7 gr (Pc(s)),14946.0,432.0,14514.0
00079,"Wardah Eyexpert Staylast Liquid Eyeliner 3,5 gr (Pc(s))",23712.0,0.0,23712.0
00080,Wardah Lightening BB Cream Light 15 ml (pc(s)),8739.0,576.0,8163.0
00081,Wardah Lightening BB Cream Light 30 ml (Pc(s)),815.0,108.0,707.0
00082,Wardah Lightening BB Cream Natural 15 ml (pc(s)),9840.0,3312.0,6528.0
00083,Wardah Lightening BB Cream Natural 30 ml (Pc(s)),2283.0,36.0,2247.0
00117,Wardah Blush On A 4 gr,1799.0,120.0,1679.0
00119,Wardah Blush On C 4 gr,5036.0,120.0,4916.0
00126,Wardah Everyday BB Cream Light 15 ml (pc(s)),9792.0,528.0,9264.0
00127,Wardah Everyday BB Cream Light 30 ml (Pc(s)),3745.0,1872.0,1873.0
00128,Wardah Everyday BB Cream Natural 15 ml (Pc(s)),44880.0,672.0,44208.0
00129,Wardah Everyday BB Cream Natural 30 ml (Pc(s)),14724.0,0.0,14724.0
00133,"Wardah Evd Lum Creamy Foundation Extra Cover 04 Natural 8,5 g (Pc(s))",1.0,0.0,1.0
00135,Wardah Evd Lum Creamy Foundation Light Feel 02 Light Beige 11 g (Pc(s)),6.0,0.0,6.0
00138,Wardah Evd Lum Face Powder 01 Light Beige 30 g (Pc(s)),3830.0,240.0,3590.0
00139,Wardah Evd Lum Face Powder 02 Beige 30 g (Pc(s)),4512.0,240.0,4272.0
00140,Wardah Evd Lum Face Powder 03 Ivory 30 g (Pc(s)),5616.0,192.0,5424.0
00141,Wardah Evd Lum Face Powder 04 Natural 30 g (Pc(s)),6288.0,96.0,6192.0
00146,Wardah Evd Lum Two Way Cake 01 Light Beige 12 g (Pc(s)),4671.0,36.0,4635.0
00147,Wardah Evd Lum Two Way Cake 02 Beige 12 g (Pc(s)),4102.0,36.0,4066.0
00148,Wardah Evd Lum Two Way Cake 03 Ivory 12 g (Pc(s)),3824.0,36.0,3788.0
00149,Wardah Evd Lum Two Way Cake 04 Light Ivory 12 g (Pc(s)),3272.0,0.0,3272.0
00217,Wardah Refill Evd Lum Two Way Cake 01 Light Beige 12 g (Pc(s)),11062.0,0.0,11062.0
00218,Wardah Refill Evd Lum Two Way Cake 02 Beige 12 g (Pc(s)),7368.0,144.0,7224.0
00219,Wardah Refill Evd Lum Two Way Cake 03 Ivory 12 g (Pc(s)),6800.0,432.0,6368.0
00220,Wardah Refill Evd Lum Two Way Cake 04 Light Ivory 12 g (Pc(s)),8226.0,144.0,8082.0
00244,Wardah Renew You Anti Aging Day Cream 17 ml (pc(s)),25.0,0.0,25.0
00264,Wardah Creamy Body Butter With Lavender & Ginger 50 ml (Pc(s)),352.0,0.0,352.0
00265,Wardah Creamy Body Butter With Milk & Pearl 50 ml (Pc(s)),2146.0,32.0,2114.0
00266,Wardah Creamy Body Butter With Olive 50 ml (pc(s)),2932.0,32.0,2900.0
00267,Wardah Creamy Body Butter With Passion Fruit 50 ml (Pc(s)),2784.0,32.0,2752.0
00268,Wardah Creamy Body Butter With Rose 50 ml (pc(s)),320.0,0.0,320.0
00269,Wardah Creamy Body Butter With Strawberry 50 ml (Pc(s)),3110.0,32.0,3078.0
00278,Wardah Creamy Body Butter With Olive 150 ml (Pc(s)),228.0,132.0,96.0
00279,Wardah Creamy Body Butter With Passion Fruit 150 ml (Pc(s)),4.0,0.0,4.0
00282,Wardah Olive Oil For Massage 150 ml,1.0,0.0,1.0
00283,Wardah Pure Olive Oil 50 ml,5264.0,112.0,5152.0
00284,Wardah Soft Body Scrub With Olive 150 ml (Pc(s)),127.0,36.0,91.0
00285,Wardah Soft Body Scrub With Olive 240 ml (Pc(s)),240.0,8.0,232.0
00286,Wardah Soft Body Scrub With Passion Fruit 150 ml (Pc(s)),960.0,24.0,936.0
00287,Wardah Soft Body Scrub With Strawberry 150 ml (Pc(s)),712.0,24.0,688.0
00288,Paket Haji Dan Umroh Wardah (Pc(s)),43.0,0.0,43.0
00289,Wardah White Secret Day Cream 17 ml (pc(s)),38.0,0.0,38.0
00301,"Hair Tonic Ginseng, 200 ml",12072.0,120.0,11952.0
00303,"Hair Tonic Ginseng, 450 ml",3624.0,84.0,3540.0
00304,"Hair Tonic Ginseng, 2 L",858.0,6.0,852.0
00305,"Hair Tonic Normal Hair (Yellow), 200 ml",3984.0,72.0,3912.0
00307,"Hair Tonic Normal Hair (Yellow), 450 ml",2316.0,0.0,2316.0
00308,"Hair Tonic Normal Hair (Yellow), 2 L",672.0,0.0,672.0
00309,"Hair Tonic Normal to Oily Hair (Green), 200 ml",20256.0,192.0,20064.0
00311,"Hair Tonic Normal to Oily Hair (Green), 450 ml",8438.0,96.0,8342.0
00312,"Hair Tonic Normal to Oily Hair (Green), 2 L",210.0,90.0,120.0
00314,Putri Natural Candlenut Oil 100 ML (Pc(s)),756.0,0.0,756.0
00332,Putri Platinum Hair Mask 720 ML (Pc(s)),492.0,0.0,492.0
00334,Putri Platinum Neutralizer Step 2 720 ML (Pc(s)),2256.0,48.0,2208.0
00336,Putri Platinum Pustreite Step 1 720 ML (Pc(s)),1560.0,0.0,1560.0
00339,Putri Cold Wave 450 ML (Pc(s)),268.0,0.0,268.0
00343,Putri Neutralizer Lotion 450 ML (Pc(s)),450.0,24.0,426.0
00349,Putri Pustreite Step 2 720 ML (Pc(s)),720.0,0.0,720.0
00351,Putri Pure Clean Hair Conditioner Apple 450 ML (Pc(s)),4671.0,0.0,4671.0
00352,Putri Pure Clean Hair Conditioner Apple 2 L (Pc(s)),510.0,0.0,510.0
00353,Putri Pure Clean Hair Conditioner Apple 5 L (Pc(s)),742.0,0.0,742.0
00355,Putri Pure Clean Hair Conditioner Floral 200 ML (Pc(s)),696.0,0.0,696.0
00356,Putri Pure Clean Hair Conditioner Floral 450 ML (Pc(s)),2124.0,0.0,2124.0
00357,Putri Pure Clean Hair Conditioner Floral 2 L (Pc(s)),339.0,0.0,339.0
00360,Putri Pure Clean Shampoo Apple 200 ML (Pc(s)),6480.0,24.0,6456.0
00361,Putri Pure Clean Shampoo Apple 450 ML (Pc(s)),1788.0,0.0,1788.0
00362,Putri Pure Clean Shampoo Apple 2 L (Pc(s)),531.0,0.0,531.0
00365,Putri Pure Clean Shampoo Lemon 200 ML (Pc(s)),1512.0,0.0,1512.0
00366,Putri Pure Clean Shampoo Lemon 450 ML (Pc(s)),564.0,0.0,564.0
00367,Putri Pure Clean Shampoo Lemon 2 L (Pc(s)),444.0,0.0,444.0
00370,Putri Shampoo Ginseng 200 ML (Pc(s)),333.0,0.0,333.0
00374,Putri SPA Series Relaxing Creambath 720 ml (pc(s)),1.0,0.0,1.0
00376,Putri SPA Series Hair Mask 720 ml (pc(s)),17.0,0.0,17.0
00377,"Hair Tonic SPA Energizing Lemon, 200 ml",528.0,0.0,528.0
00378,"Hair Tonic SPA Energizing Lemon, 450 ml",96.0,0.0,96.0
00380,"Hair Tonic SPA Relaxing Lavender, 450 ml",36.0,0.0,36.0
00381,Putri Massage Cream 1 KG (Pc(s)),471.0,0.0,471.0
00389,Putri SPA Energizing Shampoo (Lemon) 450 ML (Pc(s)),7.0,0.0,7.0
00391,Putri SPA Relaxing Shampoo (Lavender) 450 ML (Pc(s)),12.0,0.0,12.0
00398,Putri Styling Glaze 200 ML (Pc(s)),23.0,0.0,23.0
00400,Putri Wet Jelly 100 ML (Pc(s)),1920.0,0.0,1920.0
00401,Putri Wet Look 100 ML (Pc(s)),8604.0,0.0,8604.0
00514,MAKE OVER Corrective Base Make Up 02 Greenish 40 ml (Pc(s)),0.0,0.0,0.0
00515,MAKE OVER Hydration Serum 33 ml (Pc(s)),13772.0,60.0,13712.0
00516,MAKE OVER Camouflage Cream Face Concealer 5X2g (Pc(s)),1724.0,0.0,1724.0
00517,MAKE OVER Face Contour Kit 14 g (Pc(s)),3002.0,24.0,2978.0
00518,MAKE OVER Perfect Cover Creamy Foundation 01 Rich Almond 12 g (Pc(s)),0.0,0.0,0.0
00524,MAKE OVER Perfect Cover Creamy Foundation 07 Frosted White 12 g (Pc(s)),0.0,0.0,0.0
00526,MAKE OVER Ultra Cover Liquid Matt Foundation 01 Ochre 33 ml (Pc(s)),5045.0,20.0,5025.0
00527,MAKE OVER Ultra Cover Liquid Matt Foundation 02 Pink Shade 33 ml (pc(s)),2578.0,40.0,2538.0
00528,MAKE OVER Ultra Cover Liquid Matt Foundation 03 Nude Silk 33 ml (pc(s)),4260.0,20.0,4240.0
00529,MAKE OVER Ultra Cover Liquid Matt Foundation 04 Amber Rose 33 ml (Pc(s)),6.0,0.0,6.0
00530,MAKE OVER Ultra Cover Liquid Matt Foundation 05 Velvet Nude 33 ml (pc(s)),4600.0,0.0,4600.0
00531,MAKE OVER Ultra Cover Liquid Matt Foundation 06 Beige Blast 33 ml (pc(s)),820.0,0.0,820.0
00533,Make Over Ultra Cover Liquid Matt Foundation 08 Pearl 33 ml (Pc(s)),40.0,0.0,40.0
00535,"Perfect Cover TWC 01 Lace, 14 gr",10.0,0.0,10.0
00537,"Perfect Cover TWC 03 Maple, 14 gr",7.0,0.0,7.0
00538,"Perfect Cover TWC 04 Desert, 14 gr",8.0,0.0,8.0
00551,"Refill Perfect Cov. TWC 08 Honey, 14 gr",9.0,0.0,9.0
00557,MAKE OVER Silky Smooth Translucent Powder 01 Porcelain 35 g (Pc(s)),2754.0,0.0,2754.0
00558,MAKE OVER Silky Smooth Translucent Powder 02 Rosy 35 g (Pc(s)),1292.0,476.0,816.0
00559,MAKE OVER Silky Smooth Translucent Powder 03 Champagne 35 g (Pc(s),2138.0,136.0,2002.0
00560,MAKE OVER Silky Smooth Translucent Powder 04 Toffee 35 g (Pc(s)),6.0,0.0,6.0
00561,MAKE OVER Silky Smooth Translucent Powder 05 Snow 35 g (Pc(s)),1603.0,102.0,1501.0
00586,MAKE OVER Powder Eye Shadow Golden Attack 2 g (Pc(s)),1.0,0.0,1.0
00621,MAKE OVER Sparkling Powder Gold 2 g (Pc(S)),2.0,0.0,2.0
00622,MAKE OVER Sparkling Powder Silver 2 g (Pc(s)),36.0,0.0,36.0
00624,MAKE OVER Trivia Eye Shadow Emperor Brown 6 g (Pc(s)),830.0,0.0,830.0
00625,MAKE OVER Trivia Eye Shadow Golden Espress 6 g (Pc(s)),21.0,0.0,21.0
00626,MAKE OVER Trivia Eye Shadow Indian Summer 6 g (Pc(s)),5118.0,108.0,5010.0
00627,MAKE OVER Trivia Eye Shadow Natural Nude 6 g (Pc(s)),3.0,0.0,3.0
00634,MAKE OVER Trivia Eye Shadow Love At First Sight 6 g (Pc(s)),3.0,0.0,3.0
00635,MAKE OVER Trivia Eye Shadow Dolly Crush 6 g (Pc(s)),1.0,0.0,1.0
00636,MAKE OVER Trivia Eye Shadow Magical Fairy Tale 6 g (Pc(s)),2.0,0.0,2.0
00637,"MAKE OVER Eyebrow Pencil Black Lines 1,14 g (Pc(s))",9544.0,0.0,9544.0
00638,"MAKE OVER Eyebrow Pencil Brown To Earth 1,14 g (Pc(s))",50313.0,0.0,50313.0
00640,"MAKE OVER Eye Liner Pencil Black Jack 1,2 g (Pc(s))",51363.0,0.0,51363.0
00641,"MAKE OVER Eye Liner Pencil Brown Latte 1,2 g (Pc(s))",1116.0,0.0,1116.0
00642,"MAKE OVER Eye Liner Pencil Navy Blue 1,2 g (Pc(s))",1107.0,0.0,1107.0
00643,"MAKE OVER Eye Liner Pencil White Techno 1,2 g (Pc(s))",6852.0,0.0,6852.0
00649,"MAKE OVER Eye Liner Pencil Silver Lines 1,2 g (Pc(s))",7878.0,0.0,7878.0
00650,"MAKE OVER Eye Liner Pencil Nude Sleek 1,2 g (Pc(s))",2259.0,360.0,1899.0
00652,MAKE OVER Eye Liner Pencil Package Black Jack (Pc(s)),2.0,0.0,2.0
00656,MAKE OVER BO Single 01 Pink Fantasist 6 g (Pc(s)),1.0,0.0,1.0
00658,MAKE OVER BO Single 03 Promiscious Peach 6g (Pc(s)),1728.0,36.0,1692.0
00661,MAKE OVER BO Single 06 Caribbean Sunset 6 g (Pc(s)),471.0,0.0,471.0
00663,MAKE OVER BO Single 08 Cruise Coral 6 g (Pc(s)),486.0,36.0,450.0
00665,"MAKE OVER BO 01 Pink Fantasist Refill Pack 3,5 g (pc(s))",1.0,0.0,1.0
00674,MAKE OVER Cheek Marbles 20 g (Pc(s)),312.0,0.0,312.0
00675,"MAKE OVER Perfect Shade Blush On Palette 8X3,5 g (Pc(s))",60.0,0.0,60.0
00691,"MAKE OVER Lip Color Palette Peplum Pink 02 5x1,7 g (Pc(s))",0.0,0.0,0.0
00748,"MAKE OVER Lipbalm Lip Nutrition Melon Crazy 3,8 g (Pc(s))",72.0,0.0,72.0
00749,"MAKE OVER Lipbalm Lip Nutrition Orange Crush 3,8 g (Pc(s))",144.0,0.0,144.0
00750,"MAKE OVER Lipbalm Lip Nutrition Vanilla Latte 3,8 g (Pc(s))",50.0,0.0,50.0
00758,MAKE OVER Make Up Remover 100 ml (Pc(s)),1352.0,48.0,1304.0
00759,MAKE OVER Toner 100 ml (Pc(s)),2.0,0.0,2.0
00764,MAKE OVER Small Sharpener (Pc(s)),4684.0,0.0,4684.0
00775,Emina Cheek Lit Cream Blush Pink 10 ml (Pc(s)),3071.0,0.0,3071.0
00776,Emina Cheek Lit Cream Blush Peach 10 ml (Pc(s)),8161.0,0.0,8161.0
00777,Emina Cheek Lit Pressed Blush Bittersweet 3.5 gr (Pc(s)),2150.0,120.0,2030.0
00778,Emina Cheek Lit Pressed Blush Cherry Blossoms 3.5 gr (Pc(s)),360.0,0.0,360.0
00779,Emina Cheek Lit Pressed Blush Cotton Candy 3.5 gr (Pc(s)),6596.0,120.0,6476.0
00780,Emina Cheek Lit Pressed Blush Marshmallow Lady 3.5 gr (Pc(s)),6237.0,240.0,5997.0
00781,Emina Cheek Lit Pressed Blush Sugarcane 3.5 gr (Pc(s)),1199.0,0.0,1199.0
00782,Emina Cheek Lit Pressed Blush Violet Berry 3.5 gr (Pc(s)),2160.0,0.0,2160.0
00811,Emina Pop Rouge Pressed Eye Shadow Gelato 3.3 gr (Pc(s)),584.0,0.0,584.0
00812,Emina Pop Rouge Pressed Eye Shadow Romantic 3.3 gr (Pc(s)),15.0,0.0,15.0
00814,Emina Pop Rouge Pressed Eye Shadow Nude 3.3 gr (Pc(s)),1182.0,252.0,930.0
00815,Emina Eye Do! Pencil Eye Liner Black 1 gr (Pc(s)),8514.0,0.0,8514.0
00816,Emina Eye Do! Pencil Eye Liner Brown 1 gr (Pc(s)),1547.0,0.0,1547.0
00820,Emina Agent of Brow Black 1.2 gr (Pc(s)),16065.0,0.0,16065.0
00821,Emina Agent of Brow Brown 1.2 gr (Pc(s)),27748.0,0.0,27748.0
00822,Emina Star Lash Aqua Mascara 5 gr (Pc(s)),1941.0,0.0,1941.0
00824,Emina Double Agent Eyebrow Black 0.3 gr (Pc(s)),105.0,0.0,105.0
00825,Emina Double Agent Eyebrow Brown 0.3 gr (Pc(s)),1.0,0.0,1.0
00827,Emina Eye Do! Crayon Pour Les Yeux Black 0.2 gr (Pc(s)),5989.0,0.0,5989.0
00886,MAKE OVER Perfect Cover TWC 01 Lace 12 g (Pc(s)),1872.0,188.0,1684.0
00887,MAKE OVER Perfect Cover TWC 02 Coral 12 g (Pc(s)),1560.0,48.0,1512.0
00888,MAKE OVER Perfect Cover TWC 03 Maple 12 g (Pc(s)),1296.0,96.0,1200.0
00889,MAKE OVER Perfect Cover TWC 04 Desert 12 g (Pc(s)),3960.0,168.0,3792.0
00890,MAKE OVER Perfect Cover TWC 05 Cinnamon 12 g (Pc(s)),1231.0,72.0,1159.0
00891,MAKE OVER Perfect Cover TWC 07 Espresso 12 g (Pc(s)),93.0,48.0,45.0
00892,MAKE OVER Perfect Cover TWC 06 Cappuccino 12 g (Pc(s)),504.0,24.0,480.0
00893,MAKE OVER Perfect Cover Refill TWC 01 Lace 12 g (Pc(s)),1224.0,72.0,1152.0
00894,MAKE OVER Perfect Cover Refill TWC 02 Coral 12 g (Pc(s)),2016.0,0.0,2016.0
00895,MAKE OVER Perfect Cover Refill TWC 03 Maple 12 g (Pc(s)),2880.0,792.0,2088.0
00896,MAKE OVER Perfect Cover Refill TWC 04 Desert 12 g (Pc(s)),1440.0,0.0,1440.0
00897,MAKE OVER Perfect Cover Refill TWC 05 Cinnamon 12 g (Pc(s)),288.0,0.0,288.0
00900,MAKE OVER Perfect Cover TWC 08 Honey 12 g (Pc(s)),672.0,0.0,672.0
00901,MAKE OVER Perfect Cover Refill TWC 08 Honey 12 g (Pc(s)),708.0,72.0,636.0
00902,Wardah Eye Brow Black,25.0,0.0,25.0
00903,Wardah Eye Brow Brown,6.0,0.0,6.0
00933,"Wardah Eye Shadow A 3,3 gr (pc(s))",5400.0,360.0,5040.0
00939,"Wardah Eye Shadow G 3,3 gr (pc(s))",960.0,960.0,0.0
00940,"Wardah EyeXpert Eyeshadow Classic 3,3 gr",8880.0,720.0,8160.0
00941,"Wardah EyeXpert Eyeshadow Passionate 3,3 gr",999.0,0.0,999.0
00944,Wardah Exclusive Matte Lip Cream 03 See You Latte 4 gr (Pc(s)),6.0,0.0,6.0
00946,Wardah Exclusive Matte Lip Cream 05 Speachless 4 gr (Pc(s)),92.0,0.0,92.0
00947,Wardah Exclusive Matte Lip Cream 06 Feeling Red 4 gr (Pc(s)),72.0,0.0,72.0
00948,Wardah Eye Liner Black,31.0,0.0,31.0
00957,Emina Sugar Rush Lip Scrub 4.2 gr (Pc(s)),432.0,432.0,0.0
00976,"MAKE OVER Professional Highlight & Contour Palette 8 x 3,5 g (Pc(s))",290.0,288.0,2.0
00979,"MAKE OVER Intense Matte Lip Cream 001 Lavish 6,5 g (Pc(s))",36.0,0.0,36.0
00980,"MAKE OVER Intense Matte Lip Cream 002 Heiress 6,5 g (Pc(s))",1096.0,96.0,1000.0
00981,"MAKE OVER Intense Matte Lip Cream 003 Secret 6,5 g (Pc(s))",4994.0,0.0,4994.0
00982,"MAKE OVER Intense Matte Lip Cream 004 Vanity 6,5 g (Pc(s))",5043.0,0.0,5043.0
00983,"MAKE OVER Intense Matte Lip Cream 005 Impulse 6,5 g (Pc(s))",1488.0,0.0,1488.0
00984,"MAKE OVER Intense Matte Lip Cream 006 Cosmopolitan 6,5 g (Pc(s))",4146.0,0.0,4146.0
00985,"MAKE OVER Intense Matte Lip Cream 007 Scarlet 6,5 g (Pc(s))",3918.0,0.0,3918.0
00986,"MAKE OVER Intense Matte Lip Cream 008 Libertine 6,5 g (Pc(s))",3768.0,0.0,3768.0
00987,MAKE OVER BO Single 10 Passion Pink 6 g (Pc(s)),252.0,0.0,252.0
01016,Emina Dirt-less In Sight Make UP Remover 50 ml (Pc(s)),784.0,0.0,784.0
01018,Emina Top Secret Eyebrow 2.9 gr (Pc(s)),252.0,0.0,252.0
01021,Emina Moist In a Bottle 50 ml (Pc(s)),3203.0,56.0,3147.0
01039,Emina Creamy Milk Cleansing Lotion 50 ml (Pc(s)),2.0,0.0,2.0
01041,Wardah C-Defense Face Mist 55 ml (Pc(s)),22243.0,360.0,21883.0
01045,Emina Green Tea Latte Face Mask 60 ml (Pc(s)),2268.0,36.0,2232.0
01051,MAKE OVER TWC Palette 3X12 g (Pc(s)),144.0,0.0,144.0
01075,Wardah Exclusive Matte Lip Cream 09 Mauve On 4 gr (Pc(S)),57.0,0.0,57.0
01076,Wardah Exclusive Matte Lip Cream 10 Berry Pretty 4 gr (Pc(s)),38.0,0.0,38.0
01078,Wardah Exclusive Matte Lip Cream 12 Plum It Up 4 gr (Pc(s)),99.0,0.0,99.0
01081,Emina Creamatte 02 Fuzzy Wuzzy 5.5 gr (Pc(s)),48.0,0.0,48.0
01082,Emina Creamatte 03 Mauvelous 5.5 gr (Pc(s)),132.0,0.0,132.0
01102,Emina Creamatte 05 Flamingo 5.5 gr (Pc(s)),405.0,0.0,405.0
01104,Emina Creamatte 07 Tumbleweed 5.5 gr (Pc(s)),1332.0,12.0,1320.0
01107,Wardah Lipstick Longlasting 03 Simply Brown 2.3 g (Pc(s)),1589.0,360.0,1229.0
01112,Wardah Lipstick Longlasting 08 Red Velvet 2.3 g (Pc(s)),1083.0,432.0,651.0
01113,Wardah Lipstick Longlasting 09 Vibrant Red 2.3 g (Pc(s)),590.0,0.0,590.0
01114,Wardah Lipstick Longlasting 10 Stylish Mocca 2.3 g (Pc(s)),80.0,24.0,56.0
01128,Wardah Intense Matte Lipstick 10 Miss Terracotta 2.3 g (Pc(s)),5.0,0.0,5.0
01129,Wardah Intense Matte Lipstick 11 Choco Town 2.3 g (Pc(s)),3.0,0.0,3.0
01131,MAKE OVER Ultra Hi-Matte Lipstick 001 King of Pink 2.3 g (Pc(s)),1.0,0.0,1.0
01135,MAKE OVER Ultra Hi-Matte Lipstick 005 Champagne Rose 2.3 g (Pc(s)),1.0,0.0,1.0
01150,Wardah C-Defense Energizing Creamy Wash 100 ml (Pc(s)),24000.0,0.0,24000.0
01166,Emina Pop Rouge Pressed Eye Shadow Brick 3.3 gr (Pc(s)),2.0,0.0,2.0
01204,MAKE OVER Velvet Mattifying Primer 20 ml,18106.0,0.0,18106.0
01211,Emina Brush Set (Set),16550.0,0.0,16550.0
01219,"MAKE OVER Liquid Eye Liner Black 1,7 ml (Pc(s))",12802.0,0.0,12802.0
01220,Wardah Exclusive Matte Lip Cream 13 Fruit Punch 4 gr (Pc(s)),6.0,0.0,6.0
01221,Wardah Exclusive Matte Lip Cream 14 My Honey Bee 4 gr (Pc(s)),4.0,0.0,4.0
01223,Wardah Exclusive Matte Lip Cream 16 Heartbeet 4 gr (Pc(s)),7.0,0.0,7.0
01224,Wardah Exclusive Matte Lip Cream 17 Rosy Cheek 4 gr (Pc(s)),5.0,0.0,5.0
01226,Wardah C-Defense Energizing Creamy Wash 60 ml (Pc(s)),25704.0,2088.0,23616.0
01251,Emina Apricot Jam Face Scrub 60 ml (Pc(s)),4212.0,108.0,4104.0
01254,"MAKE OVER Intense Matte Lip Cream 015 Coquette 6,5 g (Pc(s))",2085.0,0.0,2085.0
01255,"MAKE OVER Intense Matte Lip Cream 016 Pixie 6,5 g (Pc(s))",5212.0,96.0,5116.0
01256,"MAKE OVER Intense Matte Lip Cream 017 Savvy 6,5 g (Pc(s))",240.0,0.0,240.0
01257,"MAKE OVER Intense Matte Lip Cream 018 Classic 6,5 g (Pc(s))",1452.0,0.0,1452.0
01258,"MAKE OVER Intense Matte Lip Cream 019 Vogue 6,5 g (Pc(s))",5271.0,0.0,5271.0
01259,"MAKE OVER Intense Matte Lip Cream 020 Style 6,5 g (Pc(s))",72.0,0.0,72.0
01263,MAKE OVER Eye Shadow Palette Nudes 10 g (Pc(s)),36.0,0.0,36.0
01284,"MAKE OVER Intense Matte Lip Cream 012 Couture 6,5 g (Pc(s))",447.0,0.0,447.0
01407,Malaysia Wardah Nude Colours Eyeshadow Passionate 3.3 g (Pc(s)),120.0,0.0,120.0
01424,"MAKE OVER Intense Matte Lip Cream 010 Lux 6,5 g (Pc(s))",441.0,0.0,441.0
01439,Wardah Intense Matte Lipstick 16 Pecan Pie 2.3 g (Pc(s)),1.0,0.0,1.0
01442,Wardah Tester Intense Matte Lipstick 15 Out of Red! 2.3 g (Pc(s)),0.0,0.0,0.0
01443,Wardah Tester Intense Matte Lipstick 16 Pecan Pie 2.3 g (Pc(s)),0.0,0.0,0.0
01444,"MAKE OVER Intense Matte Lip Cream 009 Posh 6,5 g (Pc(s))",3232.0,0.0,3232.0
01445,"MAKE OVER Intense Matte Lip Cream 011 Pompous 6,5 g (Pc(s))",6812.0,0.0,6812.0
01491,"MAKE OVER Intense Matte Lip Cream 013 Dainty 6,5 g (Pc(s))",1158.0,96.0,1062.0
01492,"MAKE OVER Intense Matte Lip Cream 014 Coco 6,5 g (Pc(s))",1686.0,0.0,1686.0
01499,MAKE OVER Hyperblack Superstay Liner 1 g ,78564.0,0.0,78564.0
01507,MAKE OVER Brow Styler Eye Definer Mocha 0.13 g,2952.0,0.0,2952.0
01520,Wardah Perfect Bright Creamy Foam Brightening + Oil Control 60 ml (Pc(s)),0.0,0.0,0.0
01524,Wardah Perfect Bright Peel Off Mask 60 ml,1.0,0.0,1.0
01525,Wardah Nature Daily Mineral+ Clarifying Clay Mask 60 ml,12996.0,0.0,12996.0
01528,Wardah Everyday Fruity Sheer Lip Balm Strawberry 4 g,6772.0,6768.0,4.0
01529,Wardah Everyday Fruity Sheer Lip Balm Grape 4 g,9228.0,4752.0,4476.0
01530,Wardah Everyday Moisture Lip Nutrition Honey 4 g,4188.0,432.0,3756.0
01531,Wardah Everyday Moisture Lip Nutrition Green Tea 4 g,2964.0,2496.0,468.0
01532,"Wardah Everyday Cheek and Lip Tint 01 Red, Set, Glow! 5.5 g",3836.0,0.0,3836.0
01533,Wardah Everyday Cheek and Lip Tint 02 My Baerry! 5.5 g,2772.0,12.0,2760.0
01554,Wardah Nature Daily Seaweed Cleansing Micellar Water 100 ml,21.0,0.0,21.0
01555,Wardah Nature Daily Seaweed Cleansing Micellar Water 240 ml,2723.0,486.0,2237.0
01556,MAKE OVER Color Stick Matte Crayon 101 Brooklyn 2.6 g,8755.0,0.0,8755.0
01557,MAKE OVER Color Stick Matte Crayon 102 Iris 2.6 g,2787.0,0.0,2787.0
01558,MAKE OVER Color Stick Matte Crayon 103 Harper 2.6 g,17357.0,0.0,17357.0
01559,MAKE OVER Color Stick Matte Crayon 104 Blake 2.6 g,4559.0,0.0,4559.0
01560,MAKE OVER Color Stick Matte Crayon 105 Skye 2.6 g,115959.0,0.0,115959.0
01571,Wardah EyeXpert The Volume Expert Mascara 7 gr (Pc(s)),42140.0,0.0,42140.0
01572,Wardah Acnederm Pure Foaming Cleanser 60 ml (Pc(s)),45497.0,2124.0,43373.0
01573,Wardah Acnederm Pore Refining Toner 100 ml (Pc(s)),22072.0,340.0,21732.0
01574,Wardah Acnederm Day Moisturizer 40 ml (Pc(s)),36482.0,300.0,36182.0
01575,Wardah Acnederm Acne Spot Treatment Gel 15 ml (Pc(s)),37180.0,2856.0,34324.0
01576,Wardah Acnederm Pore Blackhead Balm 20 g (Pc(s)),1632.0,48.0,1584.0
01577,Wardah Acnederm Face Powder 20 g (Pc(s)),9744.0,48.0,9696.0
01578,Wardah Acnederm Night Treatment Moisturizer 40 ml (Pc(s)),2997.0,660.0,2337.0
01587,MAKE OVER Powerstay Matte Powder Foundation N10 Marble 12 g,792.0,120.0,672.0
01588,MAKE OVER Powerstay Matte Powder Foundation W22 Warm Ivory 12 g,96.0,48.0,48.0
01589,MAKE OVER Powerstay Matte Powder Foundation C21 Pink Ivory 12 g,1176.0,0.0,1176.0
01590,MAKE OVER Powerstay Matte Powder Foundation W33 Honey Beige 12 g,1416.0,0.0,1416.0
01591,MAKE OVER Powerstay Matte Powder Foundation N30 Natural Beige 12 g,1968.0,408.0,1560.0
01592,MAKE OVER Powerstay Matte Powder Foundation W42 Warm Sand 12 g,444.0,24.0,420.0
01593,MAKE OVER Powerstay Matte Powder Foundation W41 Coral Sand 12 g,480.0,480.0,0.0
01595,MAKE OVER Powerstay Mattifying Transparent Powder 11 g,1470.0,42.0,1428.0
01606,Wardah Nature Daily Aloe Hydramild Moisturizer Cream 40 ml,57.0,30.0,27.0
01607,Wardah Nature Daily Witch Hazel Purifying Moisturizer Gel 40 ml ,19671.0,90.0,19581.0
01608,Wardah Nature Daily Seaweed Balancing Facial Wash 60 ml ,6980.0,108.0,6872.0
01610,Wardah Nature Daily Seaweed Balancing Facial Scrub 60 ml ,11376.0,144.0,11232.0
01617,Wardah Nature Daily Aloe Hydramild Multifunction Gel 100 ml,28860.0,660.0,28200.0
01619,Wardah Nature Daily Aloe Hydramild Facial Wash 60 ml ,8964.0,1440.0,7524.0
01620,Wardah Nature Daily Aloe Hydramild Facial Wash 100 ml ,3510.0,630.0,2880.0
01621,Wardah Nature Daily Mineral+ Clarifying Facial Foam 60 ml ,4391.0,180.0,4211.0
01622,MAKE OVER Cliquematte Lip Stylo 201 Eclair 2 g,6829.0,0.0,6829.0
01623,MAKE OVER Cliquematte Lip Stylo 202 Hollywood 2 g,6171.0,0.0,6171.0
01624,MAKE OVER Cliquematte Lip Stylo 203 Crush 2 g,10424.0,0.0,10424.0
01626,MAKE OVER Cliquematte Lip Stylo 205 Jetsetter 2 g,3826.0,0.0,3826.0
01627,MAKE OVER Cliquematte Lip Stylo 206 Grandiose 2 g,1609.0,492.0,1117.0
01629,MAKE OVER Cliquematte Lip Stylo 208 Spotlight 2 g,2.0,0.0,2.0
01631,Wardah Nature Daily Mineral+ Clarifying Facial Foam 100 ml ,6508.0,150.0,6358.0
01632,Wardah Lightening Day Cream 30 g (Pc(s)),3.0,0.0,3.0
01639,Emina Magic Potion 01 Scarlet 5.5 ml,3324.0,0.0,3324.0
01640,Emina Magic Potion 02 Sunglow 5.5 ml,11796.0,0.0,11796.0
01641,Emina Magic Potion 03 Smitten 5.5 ml,8196.0,0.0,8196.0
01642,Emina Cheek Lit Cream Blush Violet 10 ml ,3990.0,0.0,3990.0
01643,Emina Cheek Lit Cream Blush Nudie Brown 10 ml ,3290.0,560.0,2730.0
01644,Emina Creamatte 08 Pumpkin Spice 5.5 gr ,1836.0,144.0,1692.0
01645,Emina Creamatte 09 Baby Fox 5.5 gr ,12.0,0.0,12.0
01646,Emina Creamatte 10 Starfish 5.5 gr ,355.0,0.0,355.0
01647,Emina Creamatte 11 Amazeballs 5.5 gr,2352.0,0.0,2352.0
01648,Emina Aqua Infused Sleeping Mask 30 g,14052.0,64.0,13988.0
01649,Emina Cranberry Juice Face Mask 60 ml ,3.0,0.0,3.0
01650,Emina Avocado Honey Face Mask 60 ml ,540.0,0.0,540.0
01651,MAKE OVER Silky Smooth Translucent Powder 06 Buttermilk 35 g,3434.0,680.0,2754.0
01652,MAKE OVER Silky Smooth Translucent Powder 07 Vanilla 35 g,850.0,544.0,306.0
01668,Wardah Lipstick Longlasting 17 Passionate Red 2.3 g,480.0,12.0,468.0
01673,MAKE OVER Powerstay Precision Liquid Liner Jet Black 2.7 g,759.0,0.0,759.0
01677,Emina Creamatte 12 Perky Plum 5.5 gr,1152.0,156.0,996.0
01678,Emina Creamatte 13 Beet Bites 5.5 gr,1824.0,0.0,1824.0
01692,Wardah Instaperfect GLOSS CHIC Lip Crayon 01 Rhythm 2.7 g,24.0,0.0,24.0
01694,Wardah Instaperfect GLOSS CHIC Lip Crayon 03 Mind 2.7 g,1.0,0.0,1.0
01695,Wardah Instaperfect MATTECENTRIC Lip Crayon 01 Pace 3 g,42.0,0.0,42.0
01697,Wardah Instaperfect MATTECENTRIC Lip Crayon 03 Honor 3 g,24.0,0.0,24.0
01699,Wardah Instaperfect MATTECENTRIC Lip Crayon 05 Sense 3 g,9.0,0.0,9.0
01705,Wardah Hair Fall Treatment Conditioner 170 ml (Pc(s)),15492.0,882.0,14610.0
01706,Wardah Nutri Shine Conditioner 170 ml (Pc(s)),6925.0,198.0,6727.0
01707,Wardah EyeXpert Eyebrow Kit 3 g (Pc(s)),4223.0,1824.0,2399.0
01708,Wardah Renew You Anti Aging Facial Wash 100 ml (Pc(s)),1490.0,0.0,1490.0
01735,Emina Pore Ranger 20 ml (Pc(s)),12446.0,108.0,12338.0
01762,Wardah Instaperfect CITY BLUSH Blusher Click 02. Adore 5.6 g,373.0,0.0,373.0
01763,MAKE OVER Riche Glow Face Highlighter 13 g,1240.0,0.0,1240.0
01770,MAKE OVER Lip Amplify Contour Liner 01 Exposed 0.2 g,10.0,0.0,10.0
01771,MAKE OVER Lip Amplify Contour Liner 02 Flatter 0.2 g,173.0,0.0,173.0
01774,MAKE OVER Lip Amplify Contour Liner 05 Pin Up 0.2 g,2855.0,0.0,2855.0
01775,Wardah Scentsation Bliss Body Mist 100 ml (Pc(s)),13789.0,225.0,13564.0
01776,Wardah Scentsation Joyful Body Mist 100 ml (Pc(s)),11453.0,250.0,11203.0
01777,Wardah Scentsation Peaceful Body Mist 100 ml (Pc(s)),12116.0,75.0,12041.0
01778,Wardah Scentsation Passion Body Mist 100 ml (Pc(s)),8200.0,75.0,8125.0
01779,Wardah Scentsation Bliss Eau De Toilette 35 ml (Pc(s)),29.0,0.0,29.0
01780,Wardah Scentsation Joyful Eau De Toilette 35 ml (Pc(s)),6006.0,36.0,5970.0
01781,Wardah Scentsation Peaceful Eau De Toilette 35 ml (Pc(s)),1656.0,36.0,1620.0
01782,Wardah Scentsation Passion Eau De Toilette 35 ml (Pc(s)),2137.0,0.0,2137.0
01793,Emina Masquerade Face Mask Rice 23 g,123200.0,0.0,123200.0
01794,Emina Masquerade Face Mask Pomegranate 23 g,26917.0,0.0,26917.0
